,abierta_comentarios,autor,cuerpo,fecha,seccion,titulo,url
45,True,Ernesto Tenembaum,"En abril de este año, Guido Sandleris asistía en Washington a la tradicional spring meeting del Fondo Monetario y el Banco Mundial. Durante esos mismos días, los grandes bancos y fondos de inversión suelen organizar actividades paralelas. En una de ellas, le preguntaron a los inversores cuál sería el mejor país del mundo para invertir en el 2018. Sandleris disfrutó en vivo y en directo al ver cómo la mayoría de los asistentes apoyaba su dedo índice en el sector de la pantalla del iPad donde figuraba el territorio argentino. El gradualismo no tenía nada que temer: había dinero para rato. Dos semanas después, en un aeropuerto, Sandleris se encontró casualmente con dos administradores de Fondos quienes, alterados, le expresaron su nerviosismo respecto de los números argentinos. Él intentó aclararles que no era así, que magnificaban los problemas. Cuando se separó de ellos, marcó el número de Luis Caputo, por entonces ministro de Finanzas: —Creo que tenemos problemas serios— le dijo. Ninguno de los dos –ni ninguna otra persona en el mundo– imaginaba la magnitud de esos problemas. Estaba por producirse un fenómeno muy estudiado por economistas como Sandleris, que se llama ""sudden stop"" (freno súbito). Con el correr de los días, Sandleris y Caputo se sorprenderían por la violencia de ese cambio. A principios de mayo, solo quince días después de aquel lejano día de euforia, Sandleris volvía a Washington. El gradualismo ya había muerto. Su objetivo ahora era articular un acuerdo con el Fondo Monetario Internacional porque el dinero, en lugar de llegar a raudales, huía despavorido. Su compañero de viaje en esa aventura era Federico Sturzenegger, por entonces presidente del Banco Central. En el arranque de esta nota, Sandleris era jefe de la Unidad de Coordinación del Ministerio de Economía, Luis Caputo era ministro de Finanzas y Federico Sturzenegger presidente del Banco Central. Parece hace un siglo. En el tercer párrafo de esta misma nota, Sturzenegger se fue del Gobierno, Caputo se transformó en presidente del Central, y Sandleris ascendió a secretario de Política Económica, en reemplazo de Sebastián Galiani, quien era la mano derecha de Nicolás Dujovne y renunció, con un timing envidiable, el 24 de abril de este año. En este párrafo, todo volvió a cambiar: ahora el que se fue del Gobierno fue Luis Caputo. Y Sandleris lo reemplazará. ¿Alguien podría asegurar que el próximo párrafo no incluiría nuevos cambios si esta nota tuviera que escribirse en unas horas? En cualquier país la renuncia del presidente del Banco Central es un hecho ciertamente inusual. Se supone que ese cargo debe tener una jerarquía que lo aleje de presiones circunstanciales y urgencias electorales. Es demasiado serio para andar jugando con él. Que renuncien dos presidentes del Banco Central en cuatro meses, ya es un hecho exótico, aun en el país de los cinco presidentes en una semana. Si además, en ese mismo período, se van el vicejefe de Gabinete y el ministro de Energía, cualquier observador externo percibirá un gobierno en descomposición. A la nómina hay que agregarle el ya mencionado Sebastián Galiani. Son datos alarmantes. Naturalmente, a la renuncia de Luis Caputo, le siguió un salto en el dólar y más venta de reservas. ""Con Sandleris empezaremos a vencer a la inflación"", dijo el ministro Dujovne. El tiempo dirá si es así. El nuevo titular del Banco Central es un especialista en macroeconomía, no en corridas cambiarias, como Caputo, o Finanzas, como Sturzenegger. Apenas sabe de esto por los libros. Eso no quiere decir que necesariamente termine mal. Ben Bernanke, Alan Greenspan y Janet Jellen también provenían de la academia. Pero ese detalle le obligará a un esfuerzo extra. Por ejemplo, el dólar subió ayer un peso en los últimos minutos de la rueda. ¿Quién lo hizo subir? ¿Lo sabrá Sandleris? ¿Tomará el Central alguna represalia por una operación cuyo origen se puede rastrear fácilmente? ¿Sabrá que las personas que pelean contra él son hijos del rigor o les tolerará estos abusos? Su asunción revela que, paso a paso, Dujovne se va transformando en el superministro que resistía Macri. Bajo su órbita quedó casi todo. Pero, ¿no se trata del mismo Dujovne que estuvo a punto de renunciar hace tres semanas, cuando la Casa Rosada le ofreció su cargo a Carlos Melconian? ¿El poder es suyo o de los burócratas del Fondo que voltearon a Caputo? Todo es un tembladeral. Hace varias semanas que los hombres de Dujovne advertían de su distancia con Caputo. Hay un episodio público que revela la existencia de esos conflictos. A principios de septiembre, el fin de semana posterior a la corrida que depositó el dólar en los 40 pesos, se había anunciado un viaje de Dujovne y Caputo a Washington para negociar con el FMI. A último momento, Caputo se bajó del avión. ""Es necesario en la Argentina para manejar personalmente la corrida contra el peso"", dijeron en el Banco Central. ""No es cierto –aclararon desde Hacienda–. Se bajó porque en el Fondo es muy resistido. Ellos creen que Caputo usa reservas sin consultarlos y se patina así la plata del préstamo. Además, le adjudican con razón el anuncio que hizo el Presidente en medio de la corrida de un nuevo acuerdo con el Fondo que no existía"". En el Banco Central, admitían los conflictos con el Fondo Monetario. En privado, Caputo relata estas últimas semanas como un suplicio interminable donde él peleaba para intervenir sorpresivamente en el mercado y los funcionarios del Fondo le ataban las manos. Así explica que el dólar subió a cuarenta –cuando el FMI lo obligó a dejarlo flotar–, que fue controlado con las primeras intervenciones sorpresivas, que se soltó cuando el Fondo impuso otra vez su visión y que volvió a su cauce cuando otra vez desobedeció. Dujovne y Caputo coinciden en que el FMI detestaba a Caputo y por eso puso como condición la renuncia del segundo para anunciar el nuevo acuerdo. Ahora, si Caputo pudo controlar el dólar, ¿por qué no se aplazó su renuncia para luego de unos meses de tranquilidad cambiaria? ¿Tan poca autonomía le queda al Presidente que no puede defender a un hombre de confianza que, además, le sirvió en estas semanas? Por otra parte, si el dólar subía cuando el FMI tomaba solo algunas decisiones, ¿qué pasará ahora que el FMI tomará todas las decisiones? En el Gobierno creen que el nuevo acuerdo, cuyo anuncio formal es inminente, cambia esa situación: sin déficit fiscal primario, con mejores cuentas externas, sin la presión de las Lebacs, el tipo de cambio se estabilizaría. Es como decir que lo peor ya pasó: apenas un pronóstico más. En este contexto, el lunes, durante una cena de gala, pocas horas antes del inicio de un paro general de una enorme potencia, el presidente Mauricio Macri prometió en Manhattan hacer de celestina entre el pueblo argentino y Christine Lagarde, la presidenta del Fondo Monetario Internacional. El FMI tiene la peor fama en la Argentina. Su regreso al país se produce durante un año terrible. ¿Qué necesidad tiene un presidente de asociar tanto su imagen, de por sí alicaída, con una de las organizaciones mundiales más resistidas por sus votantes? El episodio es, ciertamente, menor. Pero forma parte de una seguidilla. Fue el mismo Macri el que anunció en mayo un acuerdo con el Fondo que no existía, pocos minutos antes de la apertura de los mercados. Eso disparó el dólar. Y lo hizo de nuevo algunos meses después, con el mismo efecto. Fue él quien designó a tantos funcionarios que ya no están, el que resistió la existencia de un ministro coordinador, el que confió en que los mercados jamás lo abandonarían, el que renunció a tomar medidas que controlen un poco los desbordes. Algunos de sus funcionarios argumentan que el cambio de clima fue tan brutal desde abril que ningún ser humano sería capaz de absorber ese cachetazo: cualquiera quedaría grogui, al borde del knock out. Pero esa mirada piadosa no resuelve el problema. ""I am ready to run"", dijo el Presidente cuando le preguntaron por su reelección. Se vienen semanas claves. Recién después de ellas se sabrá en qué dirección lo hará.",26/09/18,politica,Un suplicio interminable,https://www.infobae.com/politica/2018/09/26/un-suplicio-interminable/&sa=U&ved=0ahUKEwjj_ufugJneAhUP1lkKHfwwCVgQFggTMAA&usg=AOvVaw3G3fBGuO2gvon9FtBuKMbo
46,True,,"El Gobierno resolvió un reordenamiento del servicio de las custodias en la Casa Rosada. El Ministerio de Seguridad de la Nación dispuso nuevas pautas y protocolos en la organización del personal a cargo del resguardo de los funcionarios de más alto nivel, entre ellos la vicepresidenta Gabriela Michetti y el jefe de Gabinete, Marcos Peña. La resolución 757/2018, publicada ayer en el Boletín Oficial, fijó entre las nuevas pautas para las custodias la prohibición del uso de sirenas y balizas para los vehículos afectados a los traslados, con la excepción que ""la vida o integridad física del custodiado se encuentre en situación de riesgo, poniendo en inmediato conocimiento"". Hasta entonces, la normativa no disponía ninguna precisión sobre el uso de las luces o sirenas, lo que se prevé que el acompañamiento de los funcionarios del Gabinete tenderá a ser más discreto. Además, se aclara que la nueva configuración preventiva pasará a ser ""permanentemente y no intermitente"". Otro de los nuevos aspectos en el reordenamiento es la aprobación de un protocolo de ""carácter reservado"", que afecta a la organización del personal policial a cargo del servicio de custodio y protección de Estado y ""los materiales afectados"". Además, la resolución amplía el alcance del servicio a colaboradores clave de la Jefatura de Gabinete de la Nación. En las nuevas pautas aprobadas por Seguridad, se precisa que contarán con protección especial el ""apoyo operativo"" de Marcos Peña, es decir, aquellas personas que ""sin ser ministros, tienen funciones de alto grado de sensibilidad, exposición y responsabilidad"". Otro punto destacado es la regulación del apoyo de las fuerzas de seguridad policiales y federales de acuerdo a su jurisdicción. En este sentido, las consignas policiales -es decir, el servicio de vigilancia exclusivo residencial ubicado en un punto definido-, se brindarán con el personal jurisdiccional correspondiente en los casos de la vicepresidente Michetti, el jefe de Gabinete y la ministra de Seguridad. En el caso de los otros ministerios, los requerimientos serán definidos por la cartera de Patricia Bullrich. Según los considerandos, el personal policial destinado a proteger a los funcionarios con responsabilidad política ""resulta necesario poder garantizar su seguridad integral, para lograr que puedan desempeñar su cargo de manera libre, segura y eficaz, lo que supone una cuestión de Estado trascendental para el correcto funcionamiento de la democracia representativa"". Las pautas para la distribución de los custodios está basada ""en razonables pautas objetivas, los riesgos que ameritan disponer para cada caso previsto en la presente resolución, el servicio de Protección de Estado y Custodia"", advierte el Ministerio de Seguridad de la Nación. La seguridad del Presidente Las modificaciones excluyen a la seguridad del presidente Mauricio Macri y sus familiares directos, ya que su resguardo corresponde a la Casa Militar, que está bajo la órbita de la Secretaría General de Presidencia, a cargo de Fernando de Andreis. El servicio alcanza, sin embargo, a los ex presidentes de la Nación. Según la normativa vigente, los ex jefes de Estado requieren de una protección especial ""toda vez que han desempeñado una de las más altas responsabilidades representativas de la República, y pueden verse expuestos, debido su calidad de tales, a riesgos en cuanto a su seguridad"". SEGUÍ LEYENDO: Seguridad presidencial: la custodia de Mauricio Macri recibió capacitación de las fuerzas especiales de Israel Patricia Bullrich: ""Definitivamente, el Presidente no puede viajar más en vuelos comerciales""",26/09/18,politica,Reordenan el servicio de custodias del Gabinete nacional,https://www.infobae.com/politica/2018/09/26/reordenan-el-servicio-de-custodias-del-gabinete-nacional/&sa=U&ved=0ahUKEwjj_ufugJneAhUP1lkKHfwwCVgQFggZMAE&usg=AOvVaw3eCGl-3dgGBtCmRvvA9XhG
47,True,,"El dirigente social Juan Grabois consideró que el macrismo no califica como ""una categoría política"" sino que se trata de ""una administración poco eficaz"", y respecto a ese modelo económico advirtió: ""Hay un sector que ya no aguanta más que se lo excluya"". A una semana de su detención durante unas horas en una comisaría de la Policía de la Ciudad, dio su visión sobre la realidad de los movimientos sociales en la Argentina: ""Cuando hablan de nosotros elogiosamente, dicen que nosotros contenemos. La función de los movimientos sociales no es contener, es transformar"". A propósito, el referente de la Ctep alertó: ""Para transformar, hay un sector de la sociedad que tiene que comprender que este sistema de exclusión tarde o temprano estalla. El sector de la economía popular en algún momento no va a aguantar más"". De todos modos, durante una entrevista en C5N, Grabois aclaró que no hay que caer en ""trampas"", y explicó: ""A los gobiernos hay que ponerlos en las urnas, no a partir de operaciones callejeras. No me cabe duda de que tiene que haber continuidad institucional en la Argentina"". Consultado sobre el panorama de la oposición a Cambiemos de cara a las elecciones de 2019, cuestionó sin dar nombres a algunos de los dirigentes que se presentan como críticos del Gobierno: ""Todos aquellos que no planteen que este modelo de país es inviable para vivir con mínima justicia social, son lo mismo que Macri, pero con diferente apellido"". Finalmente, evitó confirmar si él será una de las opciones opositoras aunque resaltó: ""Voy a hacer todo lo posible para no ser candidato pero voy a trabajar fuertemente en la construcción de un frente electoral opositor que derrote a Macri en las próximas elecciones"". SEGUÍ LEYENDO: Con la mira puesta en 2019, Juan Grabois lanza un frente político propio",26/09/18,politica,"Juan Grabois: ""Este sistema de exclusión estalla tarde o temprano""",https://www.infobae.com/politica/2018/09/26/juan-grabois-este-sistema-de-exclusion-estalla-tarde-o-temprano/&sa=U&ved=0ahUKEwjj_ufugJneAhUP1lkKHfwwCVgQFggfMAI&usg=AOvVaw2eI2AowPopRVX8Ae0uo6XL
48,True,,"El presidente Mauricio Macri pasó a saludar esta noche a Margarita Barrientos, fundadora del comedor Los Piletones. El encuentro se produjo momentos antes de que comenzara en La Rural la cena anual que organiza la fundación que lidera Barrientos con el objetivo de recaudar fondos para obras solidarias. También participaron del evento las ministras de Desarrollo Social, Carolina Stanley, y de Seguridad, Patricia Bullrich; el ministro del Interior, Obras Públicas y Vivienda, Rogelio Frigerio, y el titular provisional del Senado, Federico Pinedo, entre otras autoridades. Además, estuvieron el vicejefe de gobierno porteño, Diego Santilli, y los intendente de Quilmes y Tres de Febrero, Martiniano Molina y Diego Valenzuela. También dijeron presente el titular de Fiat Argentina, Cristiano Rattazzi, el abogado Fernando Burlando y Gianina Maradona. La visita de Macri a La Rural ocurrió luego de una jornada extensa para el Presidente, quien llegó esta mañana de Nueva York, tras cerrar el nuevo acuerdo con el Fondo Monetario que se anunció esta tarde.",26/09/18,politica,Mauricio Macri fue a saludar a Margarita Barrientos a La Rural,https://www.infobae.com/politica/2018/09/26/mauricio-macri-fue-a-saludar-a-margarita-barrientos-a-la-rural/&sa=U&ved=0ahUKEwjj_ufugJneAhUP1lkKHfwwCVgQFgglMAM&usg=AOvVaw3Dc5uPKHels68nNZxyM2yz
49,True,,"Después de su misión diplomática a las Naciones Unidas, el presidente Mauricio Macri regresó al país y visitó este miércoles por la mañana la sede porteña de la mutual de Gendarmería nacional, que fue atacada el lunes pasado con bombas molotov. El Jefe de Estado asistió al edificio de la fuerza policial ubicado en el microcentro porteño, acompañado por la ministra de Seguridad de la Nación, Patricia Bullrich. Macri aterrizó en el país hacia las 8.30 junto a sus colaboradores. Antes de encabezar una nueva reunión de Gabinete en la Quinta de Olivos, el Presidente se dirigió a la calle Tacuarí 566, en el barrio de Monserrat, donde un grupo de manifestantes realizó el ataque. El episodio se desencadenó este lunes tras la movilización a Plaza de Mayo que realizaron las dos CTA junto al moyanismo y otros sectores sindicales confrontativos de la CGT. Se trató del preludio a la huelga general protagonizada este martes en rechazo a la política económica del Gobierno. La visita fue muy rápida e improvisada. El mandatario saludó al personal de Gendarmería y les dejó un mensaje por escrito, para luego continuar con su agenda en la Quinta de Olivos, donde lo esperaban sus ministros. ""Esta mañana llegué de Nueva York y fui directamente a conocer los pormenores del ataque y expresar mi solidaridad. Este ataque insensato requiere la condena de toda la sociedad argentina"", remarcó el Presidente a través de las redes. El hecho vandálico en el edificio de Gendarmería ya había tenido un antecedente el año pasado, cuando otro grupo de manifestantes arrojó cócteles incendiarios antes de concretarse una marcha por Santiago Maldonado. Mientras se tramita un inminente acuerdo con el Fondo Monetario Internacional (FMI), Mauricio Macri ahora seguirá de cerca la discusión con la oposición en torno al Presupuesto. Aunque todavía sigue abierta la negociación, ayer el ministro del Interior, Rogelio Frigerio, aseguró que las conversaciones con el peronismo ""están avanzadas"". SEGUÍ LEYENDO: Un grupo de manifestantes de la marcha a Plaza de Mayo atacó con bombas molotov un edificio de la Gendarmería",26/09/18,politica,Mauricio Macri visitó la mutual de Gendarmería atacada con bombas molotov,https://www.infobae.com/politica/2018/09/26/mauricio-macri-visito-la-mutual-de-gendarmeria-atacada-con-bombas-molotov/&sa=U&ved=0ahUKEwjj_ufugJneAhUP1lkKHfwwCVgQFggqMAQ&usg=AOvVaw31-bP97xQmE_qILi4FTXeO
50,True,,"A pesar de llevar el mismo nombre, Ricardo Darín, el Chino supo despegarse rápidamente de la carrera de su papá, convirtiéndose en un actor reconocido en Argentina y en España. Ahora va por más y podría ser una de las figuras que desfilarán en febrero del año que viene por la alfombra roja de los premios Oscar. El ángel, de Luis Ortega, y La noche de 12 años, de Alvaro Brechner, ambas co-protagonizadas por el joven actor, son las precandidatas a competir en la terna a mejor película extranjera en la entrega de los premios Oscar 2019, la primera en representación de Argentina y la segunda por España. El actor de 29 años que ya estuvo presente con su trabajo en los festivales cinematográficos más importantes del mundo como Cannes, adonde fue con el elenco de El Ángel, o San Sebastián, comenzó a tomar la posta del legado familiar en el 2010, cuando debutó en televisión con Alguien que me quiera. De ahí en más no paró. En la pantalla chica realizó participaciones en Los únicos, Farsantes y Viudas e hijos del Rock and Roll entre otros ciclos, hasta que en el 2015 fue uno de los protagonistas de Historia de un clan, la serie de Telefe que contaba la vida de los Puccio, la familia que se dedicó a realizar secuestros extorsivos durante los 80. Sin embargo, fue en cine donde su carrera más proliferó ya que desde el 2012 hasta la actualidad tiene en su haber nada más y nada menos que doce películas, entre ellas Muerte en Buenos Aires, Voley y La reina de España. Este año, además de las dos precandidatas al Oscar, fue una de las figuras de la comedia española Las leyes de la termodinámica, disponible en Argentina a través de streaming. Ambas basadas en hechos reales, El Ángel cuenta la historia del asesino en serie Carlos Robledo Puch, donde Darín interpreta a Ramón, el amigo que incita al protagonista a cometer los crímenes, mientras que La noche de 12 años muestra el calvario del ex presidente de Uruguay José Mujica, el ex ministro de Defensa y el periodista y escritor Mauricio Rosencof (Darín), durante la última dictadura en el vecino país. Con un futuro prometedor en la actuación, muchas veces el Chino fue titular de los portales de espectáculos por su situación personal. Estuvo de novio con Calu Rivero y con Maypi Delgado, y ahora el artista está en pareja desde hace dos años con la española Úrsula Corberó, conocida en Argentina por su papel de Tokio en La casa de papel. Si una de las dos películas antes mencionadas logra postularse para estar en la nominación de los Oscar, no sería la primera vez que el apellido Darín sonara en Los Ángeles. En el 2010 El secreto de sus ojos, protagonizada por Ricardo, Soledad Villamil y Guillermo Francella y dirigida por Juan José Campanella, ganó la estatuilla a mejor película extranjera.  Relatos Salvajes de Damián Szifron y El hijo de la novia, de Campanella, protagonizadas por Darín padre, también llegaron a estar nominadas, aunque el reconocimiento no fue para Argentina. Otra coincidencia es que la ganadora El secreto de sus ojos y la precandidata La noche de 12 años fueron realizadas por los mismos productores y en ambas participa Soledad Villamil. ¿Otra señal de buena suerte para el film español? SEGUÍ LEYENDO La película ""El Ángel"" fue elegida para representar a la Argentina en los Oscar 2019 El simpático recuerdo del ""Chino"" Darín para su abuela paterna: ""Payasa combativa"" Luis Ortega, director de ""El Ángel"": ""Mis películas nunca las fue a ver nadie, le había tomado el gustito al fracaso""",26/09/18,teleshow/infoshow,"De tal palo… La meteórica carrera del Chino Darín, muy cerca de los Oscar",https://www.infobae.com/teleshow/infoshow/2018/09/26/de-tal-palola-meteorica-carrera-del-chino-darin-muy-cerca-de-los-oscar/&sa=U&ved=0ahUKEwjNhrTygJneAhUIyFkKHcEVAQ4QFggTMAA&usg=AOvVaw3xIlCnSIddYwq8C1iy4TIO
51,True,,"Su decisión de dejar su rol como panelista de Intrusos sorprendió a más de uno, pero lo que estaba claro desde un primer momento era que Marina Calabró no pasaría mucho tiempo alejada de la pantalla chica. Lo concreto es que este miércoles 26 la periodista firmó su contrato con la productora Mandarina y a partir del próximo lunes 1° de octubre empezará a formar parte del staff de El Diario de Mariana, el ciclo que Mariana Fabbiani conduce por la pantalla de El Trece. Lo único que podría demorar apenas un día el arribo de Marina a su nuevo lugar de trabajo sería que Mariana -que se encuentra de viaje- no llegue para el lunes y entonces se postergue para el martes 2.Desde la semana próxima, Marina Calabró se suma a @ddm_oficial Bienvenida amiga a @MandarinaTVok toda la Merd! pic.twitter.com/tWBaWBIvxQ— ANGEL (@AngeldebritoOk) September 25, 2018 Quien no dejó pasar la novedad y la saludó a través de su cuenta de Twitter fue su amigo, Ángel de Brito. ""Desde la semana próxima, Marina Calabró se suma a @ddm_oficial Bienvenida amiga a @MandarinaTVok toda la Merd!"", escribió el conductor de Los Ángeles de la Mañana. Vale recordar que el pasado 31 de agosto fue el último día de Calabró al aire como integrante de Intrusos, y que se retiró en medio de una emotiva despedida de quienes fueron sus compañeros durante cuatro años. ""La decisión estaba tomada hace meses y ya lo sabían todos, pero si me quedé acá hasta hoy, fue por vos"", le dijo a Moria Casán, quien tomó la conducción del ciclo durante la ausencia de Jorge Rial. ""Gracias al canal por los ocho años de continuidad laboral que en este medio tan difícil y en estos momentos complicados, es casi milagrosa"", destacó entre lágrimas, para luego expresar: ""Intrusos va a estar en mi corazón y en mi currículum para toda la vida"". Después de dedicarle unas palabras a cada uno de sus compañeros, se  fundió en un fuerte abrazo con Adrián Pallares, con quien forjó una amistad antes incluso de formar parte del programa, y cerró con un mensaje para su actual pareja, Martín Albrecht. ""El canal me dio al amor de mi vida. Él es mi gran sostén. El hombre que me banca. Te amo con toda el alma"", lo halagó. SEGUÍ LEYENDO  Marina Calabró se despidió de ""Intrusos"" acompañada por su novio: ""América me dio al amor de mi vida"" Marina Calabró se emocionó hasta las lágrimas al recordar a su padre: ""Es un dolor interminable"" Marina Calabró: ""Antes de empezar a trabajar con Lanata, pensé en cómo se lo iba a tomar Iliana""",26/09/18,teleshow/infoshow,"Tras su salida de ""Intrusos"", Marina Calabró se suma a ""El Diario de Mariana""",https://www.infobae.com/teleshow/infoshow/2018/09/26/tras-su-salida-de-intrusos-marina-calabro-se-suma-a-el-diario-de-mariana/&sa=U&ved=0ahUKEwjNhrTygJneAhUIyFkKHcEVAQ4QFggZMAE&usg=AOvVaw2ArtG6VtRSKfEJ6A2u3WCq
