,abierta_comentarios,autor,cuerpo,fecha,seccion,titulo,url
18,True,,"El cuarto paro general que le hacen al Gobierno perjudica al país pero al mismo tiempo terminará favoreciendo al Presidente y su intención de ser reelecto. Presentado como una válvula de escape ante la crisis, los altos niveles de desocupación, la inflación y la devaluación de la moneda, no hace más que hacer patente lo que ya todo el mundo sabe. Pero, al mismo tiempo, la escenografía diaria de organizaciones políticas, sindicales y sociales protestando en la plaza de Mayo, la plaza de dos Congresos, e interrumpiendo cada tanto los accesos a la ciudad, de tan repetida y cotidiana, está empezando a banalizarse. Ayer, por caso, una parte de la plaza parecía una feria gastronómica, y los márgenes de la 9 de julio estaban repletas de micros de gente que bajaba por turnos para ocupar su lugar en la manifestación. Nadie se puede oponer al derecho de huelga ni rechazar sistemáticamente cualquier movilización. Pero sí se debe estar atento a la verdadera motivación de unos y otros. Hay dirigentes sociales que están más interesados en que Macri se vaya antes de tiempo que en mejorar el salario y la calidad de vida de los trabajadores. No son pocos los que ya lo anticiparon: Hugo y Pablo Moyano, Luis D'Elía, Emilio Pérsico y Pablo Miceli, son algunos de ellos. La ida anticipada del presidente tampoco sería hoy un mal escenario para la expresidenta Cristina Kirchner, quien a partir de febrero desfilará por los tribunales orales como acusada de los más variados delitos de corrupción. Sus incondicionales de La Cámpora no están en mejor posición que ella: Andrés Larroque, Wado de Pedro y José Ottavis, aparecen mencionados en los cuadernos de la corrupción, recibiendo dinero negro de la política. Son tan impresentables quienes agitan una buena parte de los paros y movilizaciones que terminan favoreciendo, por contraste, al jefe de Estado. Como siempre, hoy y durante el resto del año, los más afectados son los trabajadores monotribuistas, las pequeñas y medianas empresas, los que pierden el premio por presentismo y los que no califican para recibir un plan social o un subsidio del Estado. Ayer, en Nueva York, el presidente se jactaba de encabezar un proceso que sale de una devaluación sin cambiar de manera abrupta las reglas de juego. Sin embargo, no dijo ni una palabra sobre la propia responsabilidad del Gobierno en la crisis económica. Una de las razones por las que el oficialismo sigue manteniendo un núcleo duro de adherentes que supera el 30 por ciento de los votos se explica porque sus votantes entienden que estamos como estamos gracias a la herencia recibida que Macri no quiso terminar de blanquear. Sin embargo, para lograr la reelección, esa masa de adherentes no le alcanza. Necesita mostrar, primero, un ostensible repunte de la economía, que, por cierto, no sucederá este año. Y por el otro, que es capaz de contener el caos social que ciertos sectores vienen agitando, todavía sin demasiado éxito.",25/09/18,politica,El paro afecta al país pero favorece a Mauricio Macri,https://www.infobae.com/politica/2018/09/25/el-paro-afecta-al-pais-pero-favorece-a-mauricio-macri/&sa=U&ved=0ahUKEwjxnrbagJneAhVxzlkKHalpBNMQFgglMAM&usg=AOvVaw2K-SccuG6FEaGrbW7EBh6b
19,True,Silvia Mercado,"Raúl Alfonsín fue el presidente  que soportó más paros generales durante su gestión: 13. Y Néstor Kirchner el que menos, apenas uno. Carlos Menem y Fernando De la Rúa tuvieron ocho paros generales, pero el dirigente peronista gobernó 10 años y el radical apenas dos. Eduardo Duhalde, que también gobernó dos años, tuvo dos. Y Cristina Kirchner, que estuvo en el poder ocho años, padeció cinco. Mauricio Macri, hasta ahora, va por cuatro. Según un informe realizado por la Escuela de Gobierno de la Universidad Austral, se contabilizaron 41 paros generales desde el 10 de diciembre de 1983, o sea, cada 312 días. Lo peculiar no es solo la recurrencia a este tipo de medidas de fuerza que en países normales se consideran extremas, cuando ya no es posible el diálogo o se quiere dar un ultimátum a un Gobierno, sino que la predisposición a realizar paros generales es muy distinta frente a administraciones peronistas y las que no lo son. En efecto, según la casa de altos estudios, el 61% de los paros generales fue contra gobiernos no peronistas, los de Alfonsín, De la Rúa y Macri, que solo gobernaron 11 años desde 1983. En cambio, a los peronistas, que gobernaron los 24 años restantes, solo les cayeron 16 paros generales, apenas el 39% del total. Se podría dar así por probada una tolerancia mayor de las centrales sindicales frente a los gobiernos peronistas. La pregunta es, ¿a qué se debe?  Los lazos ""de familia"" que circulan entre los sindicalistas y los funcionarios cuando gobierna el peronismo seguramente son una primera explicación. También que, en términos generales, al peronismo le toca gestionar tiempos de vacas gordas, como le pasó claramente a Néstor Kirchner y que le faltó a su esposa a partir de 2009, o como se lo generó Menem desde que implantó la convertibilidad y la venta de las ""joyas de la abuela"". Desde Alfonsín, los gobiernos no peronistas han intentado normalizar el mundo sindical con leyes o normativas anticorporativas.  Lo hicieron siempre en tiempos de ajuste, y buscando atender a su propia base electoral, profundamente contraria a las conductas mafiosas que se generan en estructuras que perduran por décadas sin ninguna renovación, favoreciendo conductas delictivas. Pero con la llegada del kirchnerismo, el sindicalismo tradicional tiene un nuevo competidor, la izquierda trostkysta, que busca el fin del sistema capitalista y necesita el fracaso de las empresas para demostrar que las empresarios solo quieren la explotación de los trabajadores. El objetivo de este sindicalismo combativo no es la alianza entre el capital y el trabajo, sino que las empresas cierren y, en ese caso, como una transición al mundo comunista ideal, que ellos puedan gestionarla a través de cooperativas. Esta emergencia es la que hizo al sindicalismo tradicional más ""gordo"", más aliado al poder de turno que nunca. Macri y el sindicalismo con capacidad de parar el país tienen más intereses en común de lo que ninguno puede reconocer. En estos casi tres años de gobierno, el Presidente se dio el lujo de romper varios puentes con el sindicalismo. Se animó, por ejemplo, a desplazar del Ministerio de Trabajo a quien venía trabajando desde la Ciudad en los ámbitos gremiales, Ezequiel Sabor (hoy embajador en México), por consejo de Mario Quintana. También degradó a Jorge Triaca, poniendo a su estructura como ""Secretaría"". Este cuarto paro general, se sabe, no soluciona nada. Pero tanto en varias oficinas del Gobierno como en muchos sindicatos es visto como una medida que descomprime la protesta en un momento urgido por la drástica caída del salario real. LEA MÁS: Cambios en el Gabinete: ganadores y perdedores de dos días de negociaciones frenéticas en Olivos En medio del paro, la CGT advirtió: ""Si no hay un cambio del rumbo económico, el conflicto social va a seguir""",25/09/18,politica,El 61% de los paros generales fueron contra gobiernos no peronistas,https://www.infobae.com/politica/2018/09/25/el-61-de-los-paros-generales-fueron-contra-gobiernos-no-peronistas/&sa=U&ved=0ahUKEwjxnrbagJneAhVxzlkKHalpBNMQFggrMAQ&usg=AOvVaw2-RBQ-RGd2JgTU_aDqUhY7
20,True,,"Celeste Cid, Marcela Kloosterboer, Natalie Pérez, Violeta Urtizberea y Justina Bustos fueron las protagonistas de Las Estrellas, la tira de Pol-Ka que fue uno de los programas más vistos durante el 2017. A meses del éxito, las actrices armaron un reencuentro, pero una de ellas estuvo ausente. ""Siempre es lindo verlas"", escribió en Instagram Kloosterboer, Lucía en la ficción, junto con una foto de quienes eran sus hermanas en la novela. En la imagen se ve a quienes interpretaron a Virginia, Carla  y Flor. Sin embargo, la foto no está completa y falta Justina Bustos, quien se puso en la piel de Miranda, casualmente la menor de las hermanas, de quien las mayores desconocían su existencia. En las imágenes que ellas mismas subieron a las redes sociales se las puede ver muy divertidas en un bar tomándose selfies y chequeando sus teléfonos para ver cómo salieron. En este momento Justina, quien no pudo estar en el reencuento, es la única de las ex Estrellas que está trabajando en televisión de aire. La rubia está haciendo una participación en 100 días para enamorarse.  Natalie protagoniza con Nico Vázquez, Martín Bossi y Adrián Suar The Host por Fox y paralelamente sigue su carrera en la música; Celeste continúa con su marca de ropa y se prepara para interpretar a Susana Giménez en una serie sobre la vida de Monzón y Marcela y Violeta empezaron con las grabaciones de Otros pecados, el nuevo unitario de Pol-Ka. SEGUI LEYENDO Test: ¿a cuál de ""Las Estrellas"" te parecés? Natalie Pérez mostró su panza al natural: ""Si la meto queda trabadita, pero si me relajo…""",25/09/18,teleshow/infoshow,"El reencuentro de ""Las estrellas"", con una gran ausente",https://www.infobae.com/teleshow/infoshow/2018/09/25/el-reencuentro-de-las-estrellas-con-una-gran-ausente/&sa=U&ved=0ahUKEwjksIvegJneAhUwuVkKHSATDvsQFggTMAA&usg=AOvVaw1CYkasOGYRUgdiZd7TnZ4x
21,True,,"El Festival Internacional de Cine de San Sebastián ya está en pleno desarrollo, con cuatro jornadas en donde el cine argentino sigue siendo protagonista de esta 66° edición, con nada menos que catorce títulos distribuidos en todas las secciones de la muestra. Pero si la cifra llama la atención por la numerosa representación nacional, el récord que se desprende de esta lista está marcado por las seis directoras que presentan sus películas en tierras vascas. En un momento en donde las mujeres dan pelea para alcanzar la igualdad de derechos en todos los ámbitos, el cine es otro de los sectores del debate, en tanto la actividad sigue dominada por los hombres. Es por eso que cobra una relevancia para nada menor que cinco directoras argentinas estén presentes en España, probablemente el país con más realizadoras en el festival y que en las diferentes proyecciones y presentaciones han sumado aplausos y reconocimiento. Comenzando por la sección Horizontes Latinos -en donde compiten los films latinoamericanos más relevantes del año-, María Alché, la actriz recordada por su papel en La niña santa de Lucrecia Martel, debuta como directora con Familia sumergida protagonizada por Mercedes Morán, que debe transitar el duelo por la pérdida de un ser querido durante un verano asfixiante en Buenos Aires. También con Morán, esta vez junto a Gustavo Garzón, se presentó Sueño de Florianópolis de Ana Katz (El juego de la silla, Una novia errante, Los Marziano), una comedia sobre una pareja que decidió separarse pero antes emprende un viaje familiar a Brasil. La cordobesa Inés Barrionuevo (Atlantida) participa en el apartado Nuevos Directores con Julia y el zorro, una historia también signada por una pérdida, en donde una ex actriz y su hija deben encontrar la manera conectarse e intentar volver a formar una familia. El protagonismo de las mujeres argentinas detrás de las cámaras se completa con dos películas incluidas en la sección Zabaltegui -dedicada al cine más arriesgado de todo el mundo-, Teatro de guerra de Lola Arias, una reflexión sobre el conflicto de Malvinas protagonizada por ex combatientes argentinos y británicos; y por último se espera con expectativa la proyección de Las hijas del fuego de Albertina Carri (Los rubios, Cuatreros, La rabia), una revulsiva mirada sobre el cuerpo femenino, con un relato anárquico que fluctúa entre el ensayo y la pornografía. Habrá que ver cómo será recibida por el público de San Sebastián. Fuerte presencia argentina en Biarritz A menos de 50 kilómetros de San Sebastián pero ya en territorio francés, ayer comenzó la 27º edición del Festival de Biarritz Amérique Latine, en donde la Argentina también tiene una fuerte presencia, con varias películas nacionales en ficción, documentales y cortos, aunque sin duda hay que destacar el riesgo que asumió la muestra francesa al programar La flor, el kilométrico film de Mariano Llinás que dura nada menos que catorce horas y que se verá en tres partes. La película de Llinás compite por el premio mayor de Largometrajes de Ficción en Biarritz junto a Malambo, el hombre bueno, de Santiago Loza. Por el lado de los documentales la Argentina está presente con Teatro de guerra (Lola Arias), Años luz (Manuel Abramovich sobre el cine de Lucrecia Martel) y Buenos Aires al Pacífico (Mariano Donoso),todas ellas aspirantes al galardón principal de la categoría. Cabe destacar que La noche de 12 años de Álvaro Brechner con el Chino Darín, que inauguró el festival, acaba de ser elegida por Uruguay para los próximos Oscar y es una coproducción con Argentina y Francia. Por Hugo Fernando Sánchez, desde San Sebastián SEGUÍ LEYENDO El cine argentino es protagonista absoluto en el Festival de San Sebastián Darío Grandinetti: ""El gobierno quiere desaparecer la cultura, la salud y la educación""",25/09/18,teleshow/infoshow,Las directoras argentinas cosechan reconocimiento en el Festival de San Sebastián,https://www.infobae.com/teleshow/infoshow/2018/09/25/las-directoras-argentinas-cosechan-reconocimiento-en-el-festival-de-san-sebastian/&sa=U&ved=0ahUKEwjksIvegJneAhUwuVkKHSATDvsQFggZMAE&usg=AOvVaw0qup7HL5J4HmdigoUJJLvT
22,True,,"Son bellas y exitosas, pero no tienen suerte en el amor. Siguiendo los pasos de la gran diva de la Argentina, Susana Giménez, quien después del cenicerazo contra Huberto Roviralta, que le costó 10 millones de dólares, no pudo volver a confiar plenamente en los hombres, algunas de las mujeres más lindas de nuestro país parecen no poder superar sus desengaños amorosos. Dueña de una figura escultural, Sol Pérez se convirtió en una de las mujeres más deseadas por los hombres. Sin embargo, ella reconoce que se equivoca a la hora de elegir candidato. ""En el amor siempre le pifio y debe ser porque no le dedico tiempo suficiente a conocer a la gente"", dice la actual participante del Bailando 2018, quien además  es panelista de Los Especialistas del Show, en El Trece, conduce Online (antes Pampita Online) por KZO, forma parte de la mesa de Show Attack por Radio Uno y está terminado la gira de la obra Magnífica. Quizás sea eso: poco tiempo libre para el amor… Aunque es muy reservada con respecto a su vida privada, en los últimos meses trascendieron dos nombres de jugadores de fútbol que llegaron al corazón de Sol: Lisandro Magallán y Exequiel Palacios. Al central de Boca lo dejó al enterarse de que el muchacho habría ventilado cuestiones íntimas de la pareja en sus charlas de vestuario. Y con el volante de River cortó después de caer en la cuenta, en vivo en un programa de televisión, de que además de estar con ella, el volante tendría novia y amante de manea simultánea. Y nos viene a hablar de poliamor… Así las cosas, Sol decidió que en este momento de su vida lo mejor era estar sola. Y aunque confiesa que a través de su Instagram recibe ""propuestas interesantes"" que cada tanto acepta, por lo pronto prefiere no tener compromisos amorosos y dedicarse de lleno a su trabajo. El caso de Karina Jelinek es uno de los más llamativos. Con su sensualidad a flor de piel, la modelo llegó a conquistar al mismísimo Luis Miguel, entre otros tantos famosos cuyos nombres no trascendieron a la prensa. Sin embargo, después de su malogrado matrimonio con Leonardo Fariña, nunca más volvió a creer en el amor. Ella también cayó presa… pero del desamor. Apenas tres meses después de haberlo conocido, Karina se casó con Fariña con una fastuosa boda para más de trescientas personas que tuvo lugar en el Tattersall de Palermo, en abril de 2011. El matrimonio duró dos años y se terminó por infidelidad. Sin embargo, en medio de esto el joven fue investigado por un caso de evasión agravada y se lo señaló por ser el ""valijero"" de Lázaro Báez. Entonces se supo que, en realidad, para Fariña la boda no había sido más que una gran puesta en escena que había pagado su ex jefe, Carlos Molinari, para darle un ""perfil empresarial"" y mayor visibilidad a su empleado. Y Karina se sintió totalmente estafada. Si bien luego intentó formar otras parejas, nunca pudo volver a entregarse de lleno a un hombre. ""Ahora, antes de salir con alguien lo googleo"", explica la modelo, que de momento sigue estando soltera y abocada a su carrera. Muchos fueron los hombres que quisieron seducirla. Sin embargo, Luciana Salazar se enamoró sólo de uno: Martín Redrado. La historia entre la modelo y el economista comenzó en marzo de 2010 y, para bien o para mal, sigue dando tela para cortar hasta el día de hoy. Es que, poco después de haber blanqueado el romance a través con una foto a través de su cuenta de Twitter, Luli tuvo que salir a contar que ambos se habían distanciado. Pero después volvieron, se separaron, se reconciliaron…Y todo, absolutamente todo, se fue conociendo a través de la red social. En 2014, en uno de esos ""impasse"" de la pareja, Redrado mantuvo una corta relación con Amalia Granata. Y Luli salió a contar intimidades de la ex pareja. Por ejemplo, que ella quería ser madre pero él, presionado por los hijos de su primer matrimonio, no quería saber nada con la idea de volver a ser papá. Con semejante escándalo el romance parecía no poder tener vuelta atrás. Pero el 2015 los encontró juntos. Y el 2016, separados… Hasta que el año pasado Luli confirmó que estaba esperando la llegada de Matilda, la beba que engendró a través de un vientre subrogado en los Estados Unidos. Y aunque en todo momento aclaró que Redrado no era el padre biológico de la criatura, sí se supo que él la habría ayudado a costear el tratamiento y que, hasta hace poco, mantenía un vínculo paternal con la bebita de 9 meses. Hace unas semanas todo explotó cuando Luli descubrió que el economista había congelado su nombre en el freezer en lo que sería una especie de brujería para tratar de alejarla de su vida. Ahora Redrado estaría saliendo con la empresaria Lulú Sanguinetti. Y a Salazar se la vinculó con el magnate estadounidense Gil Dezer. Sin embargo, la misma Luli se encargó de desmentir la noticia. ""No estoy de novia con nadie"", anunció. Y aunque no se niega a la posibilidad de volver a intentar una pareja más adelante, por ahora prefiere seguir aferrada solo al cariño de su hija. El sueño de Silvina Luna de formar una familia parece cada vez más lejano. Después de cinco años de noviazgo con el DJ Manuel Desrets, que luego (¿o a la misma vez?) empezó a salir con su amiga Victoria Saravia, la actual panelista de Incorrectas se puso de novia con Ezequiel el Polaco Cwirkaluk. El romance comenzó en el verano de 2017 cuando ambos compartieron la temporada de la obra Abracadabra en Villa Carlos Paz. Y aunque al principio trataron de ocultarlo, no tardaron mucho en salir a gritar su amor a los cuatro vientos. La relación entre Silvina y el cantante fue tan intensa como patológica. Después de comprometerse con anillo incluido, ambos tuvieron una fuerte pelea. Al punto que, según dicen, la joya habría ido a parar al inodoro de la actriz. Pero, cuando todo parecía perdido, sobrevino la reconciliación. Claro que la pareja nunca logró transitar en armonía su historia de amor. En el medio apareció el fantasma de Barby Silenzi, ex compañera del Bailando y algo más del Polaco. Y también el de Valeria Aquino, la mamá de la hija menor del cantante, Alma. En marzo de este año, después de concluir la temporada de Explosivos, ambos decidieron ponerle punto final a la relación. A Silvina las esquirlas de esta separación todavía la siguen afectando. De hecho, hace poco deslizó la posibilidad de que, tras su ruptura con Sergio Kun Agüero, Karina La Princesita Tejeda —mamá de Sol, la hija mayor del Polaco— hubiera buscado contención en su ex. Y esto le valió un duro cruce mediático con la cantante. Hoy, la rosarina se encuentra abocada a su trabajo en América, a su línea de ropa y a sus estudios de counseling. Y no quiere saber absolutamente nada con el amor. Está en Luna menguante. SEGUÍ LEYENDO Fotos exclusivas ¡y sin Photoshop!: la producción de Sol Pérez para una marca de lencería erótica El sensual baile de Karina Jelinek en la playa",25/09/18,teleshow/infoshow,Lindas y solas: las famosas argentinas que no tienen suerte en el amor,https://www.infobae.com/teleshow/infoshow/2018/09/25/lindas-y-solas-las-famosas-argentinas-que-no-tienen-suerte-en-el-amor/&sa=U&ved=0ahUKEwjksIvegJneAhUwuVkKHSATDvsQFggfMAI&usg=AOvVaw0Gbym1HTJUrOsDuxfrO2QG
23,True,,"El discurso más emotivo de la entrega de los premios Martín Fierro de Cable 2018 estuvo en boca de Sergio Lapegüe. El periodista subió al escenario junto a parte del equipo de TN al ganar la terna mejor producción integral, y le dedicó la estatuilla a su colega Débora Pérez Volpin, fallecida el 6 de febrero pasado. ""Si me permiten, quiero recordar a una persona que ha trabajado estos 25 años con nosotros y estamos pidiendo y exigiendo justicia por ella. Fuerte aplauso para Débora, este premio es para vos también. Te queremos, te extrañamos y exigimos justicia"", expresó el periodista al recibir el premio. ""Me sumo al pedido de Sergio, se lo quiero dedicar a Débora. Acá está el papá de sus hijos (por Marcelo Funes, camarógrafo de la señal), que tiene tanta humildad que ni siquiera lo mencionó, pero se lo queremos dedicar a ella y a la producción que tiene Todo Noticias"", agregó Lorena Maciel, también conductora de la señal. El jueves pasado el juez Carlos Bruniard le puso fin a la etapa de instrucción de la causa que busca determinar las circunstancias que llevaron a la muerte a Débora Pérez Volpin. En el juicio oral serán juzgados por homicidio culposo la anestesista Nélida Puente y el endoscopista Ariel Bialolenkier. Ellos participaron de la endoscopía que se realizaba la periodista, que derivó en su fallecimiento a raíz de un paro cardiorrespiratorio en el Sanatorio La Trinidad de Palermo. SEGUÍ LEYENDO Quique Sacco, a seis meses de la muerte de Débora Pérez Volpin: ""Indudablemente hubo negligencia o impericia"" Débora Pérez Volpin: la anestesista y el endoscopista serán juzgados por homicidio culposo La lista de ganadores de los premios Martín Fierro de Cable 2018",25/09/18,teleshow/infoshow,Martín Fierro de Cable 2018: el recuerdo de Sergio Lapegüe a Débora Pérez Volpin,https://www.infobae.com/teleshow/infoshow/2018/09/25/martin-fierro-de-cable-2018-el-recuerdo-de-sergio-lapegue-a-debora-perez-volpin/&sa=U&ved=0ahUKEwjksIvegJneAhUwuVkKHSATDvsQFgglMAM&usg=AOvVaw0EXmOPDvMX4O_U7kZ_l242
