,abierta_comentarios,autor,cuerpo,fecha,seccion,titulo,url
52,True,,"El sábado 12 de octubre de 1968, apenas diez días después de la masacre de Tlatelolco que marcó a México para siempre, el presidente Díaz Ordaz inauguró los XIX Juegos Olímpicos, bautizados como La Olimpiada de la Paz. Fue en el Estadio Olímpico ubicado en el corazón de la UNAM, donde estudiaban muchos de los estudiantes masacrados. Ni Díaz Ordaz ni nadie del gobierno, ni la oposición o los medios de comunicación mexicanos, hicieron una sola referencia a la matanza. Pero un inocente acto de protesta logró amargarle el día al ""presidente de la paz"". Mientras daba su discurso ante 60.000 personas, por encima suyo comenzó a volar un papalote (barrilete o cometa) de color negro en forma de paloma. Lo estaban remontando unos estudiantes en protesta por la masacre del 2 de octubre. Los televidentes de buena parte del mundo, que veían unos juegos olímpicos en directo y vía satélite por primera vez en la historia, no sabían de que se trataba. Pero sí fue muy bien interpretado por millones de mexicanos que conocían el significado de ese papalote negro. Nadie sabía en ese momento que otro gesto, de un puño negro en alto, el símbolo del Black Power, iba a convertirse en otra marca indeleble de esa olimpíada que hace cincuenta años conmovió al mundo. ———————————–. La tarde del 2 de octubre de 1968, unos 15.000 estudiantes de varias universidades marcharon por las calles de la ciudad llevando claveles rojos en la mano. Finalmente, la marcha llegó a Plaza de las Tres Culturas en Tlatelolco, donde iban a hablar los integrantes del Consejo Nacional de Huelga (CNH). Allí ya estaban las tropas del Ejército desplegadas rodeando la zona. Especialmente custodiado estaba el edificio de la Secretaría de Relaciones Exteriores, que se levanta en una de las esquinas de la plaza. Dos helicópteros sobrevolaban. Los líderes estudiantiles habían conseguido un contacto que les abrió las puertas de un departamento del tercer piso del Edificio Chihuhua, desde el que se observa y ""controla"" toda la plaza. Allí esperaron a que la gente fuera agolpándose. Había junto a ellos varios periodistas. Los fotógrafos y camarógrafos también estaban apostados en la terraza del edificio. En ese momento aparecieron en el lugar unos tipos vestidos con unos overoles que dijeron ser trabajadores de la compañía de agua de la ciudad. En realidad eran agentes del denominado Batallón Olimpia (BO), creado para dar seguridad en los Juegos Olímpicos. Al rato aparecieron otros hombres de civil que tenían un extraño pañuelo blanco enroscado en la muñeca o guantes de ese mismo color. Era la marca por la que se reconocerían. Los estudiantes no se dieron cuenta de que se trataba de infiltrados armados. El cabo Mario Sierra, del Primer Batallón del Cuerpo de Guardias Presidenciales, dio su testimonio cuarenta años más tarde de cómo se movieron las fuerzas armadas: Al mediodía nos dicen que nos vayamos a Tlatelolco para estar pendientes de lo que pudieran hacer los estudiantes en la Plaza de las Tres Culturas. Estaba con el sargento Juan de Dios Gama Estrada, que era mi superior pero también mi amigo. Nos ordenaron que no lleváramos identificaciones y, sin darnos mayores explicaciones, nos dijeron que si había problemas y éramos detenidos, pidiéramos que nos presentaran ante un agente del Ministerio Público. Ya en la delegación, deberíamos dar la consigna secreta para quedar libres: 'Yo pedí hablar con usted, señor licenciado'.            Nosotros éramos OP, Oreja de Perro, nos hacíamos pasar por estudiantes y buscábamos información de lo que estaba sucediendo. Teníamos el pelo largo y siempre andábamos vestidos así como los estudiantes. Cuando llegamos habría unas cinco mil personas pero para las 17:10 o 17:15 que empezó el acto, ya había 10.000 sino más. Vi unos movimientos que no me gustaron y llegué a reconocer a algunos de los que iban empujando para entrar en el edificio grande de enfrente (el Chihuhua). Le dije a Gama que nos corriéramos hacia una esquina. Me olía mal. Después entendí que la plaza era una ratonera y el edificio Chihuahua la trampa. En el momento en que el líder estudiantil López Osuna terminó de hablar y le cedió el micrófono al segundo orador, apareció un helicóptero volando casi al ras de los edificios y lanzó tres bengalas, dos verdes y una roja. Era la señal que estaban esperando los enguantados del Batallón Olimpia. De pronto, comenzaron los disparos de francotiradores apostados en todas las terrazas y los supuestos obreros de la compañía de aguas sacaron sus pistolas y tiraron contra los que estaban en los pasillos del tercer piso. En la terraza hirieron a la famosa periodista italiana Oriana Fallaci y la noticia comenzó a circular por Europa y pronto en todo el mundo. El periodista francés, Fernand Choisel, de la radio Europa Uno, que había cubierto unos meses antes los disturbios en París, estaba ahora en uno de los balcones del edificio Chihuahua presenciando alucinado la estrepitosa reacción militar: ""Las ametralladoras empezaron a rociarlo todo. Me tiré al suelo y fue el caos. Estaba boca abajo. Ya no veía nada. Había un ruido ensordecedor. Mi única obsesión era salirme del balcón. Correr hasta las escaleras. No recuerdo si corrí o me arrastré. […], Imagínese: el ruido de las ametralladoras afuera… las balas que rebotaban por todas partes… el agua que caía y caía"". Aún se desconoce la cifra exacta de los muertos y heridos. En ese momento, el gobierno informó que habían sido sólo veinte las víctimas. Tres años más tarde, la prestigiosa escritora Elena Poniatowska entrevistó a decenas de testigos para su trascendental libro La noche de Tlatelolco entre los que está el de una madre que buscó bajo la pila de cadáveres a su hijo. Ella le comentó a la escritora que había contado al menos 65 muertos en una sola esquina de la plaza. El periodista inglés John Rodda que había llegado a México para cubrir las Olimpíadas hizo en ese momento una investigación en los hospitales y la morgue para llegar a la conclusión de que los muertos eran 325 y los heridos más de mil. Otra investigación de la BBC logró encontrar los informes de la CIA estadounidense que hablan de 200 a 300 víctimas. De acuerdo al periodista e investigador Paco Ignacio Taibo II, quien en 1993 encabezó una Comisión de la Verdad sobre estos sucesos, en esa ""trágica"" tarde ""fueron disparados 15 mil proyectiles que dejaron 300 muertos, además de 700 heridos. Los detenidos fueron más de cinco mil. De la operación de represión participaron unos ocho mil militares. ———————-. Los juegos tuvieron un transcurso normal con algunos momentos memorables: millones de personas quedaron atónitas ante el salto de altura de Dick Fosbury, se emocionaron con la remontada del mexicano José Pedraza empujado por el aliento de 60.000 compatriotas, contemplaron cómo Enriqueta Basilio se convertía en la primera mujer en encender la Llama Olímpica y se hicieron las primeras pruebas antidopaje de la historia. Pero los juegos del 68 estuvieron marcados por otro simple acto de protesta, esta vez de dos atletas negros estadounidenses. Tommie Smith y John Carlos, dos estudiantes de la Universidad Estatal de San José, en California, habían obtenido el primer y tercer puesto en la final de los 200 metros llanos. Sabían que cuando les dieran las medallas iba a aparecer el presidente del Comité Olímpico, Avery Brundage, para darles la mano. Brundage era un racista que había estado intentando que Sudáfrica compitiera con un equipo segregado, sólo con blancos. Cuatro años más tarde se hizo célebre por no mencionar en su discurso de apertura de los juegos del 72 a los atletas judíos asesinados en la Masacre de Munich. Smith y Carlos formaban parte del Proyecto Olímpico para los Derechos Humanos (OPHR), un movimiento que buscaba romper las barreras raciales latentes en el deporte de la época. Durante los entrenamientos, unos meses antes, habían acordado que si subían al podio se enfundarían unos guantes negros, levantarían el puño en señal de protesta por la discriminación racial de su país y le darían la mano a Brundage en forma despectiva con el guante puesto. En la mañana del 16 de octubre de 1968, Tommie Smith ganó la carrera de los 200 metros con un récord mundial de 19.83 segundos, con el australiano Peter Norman en segundo lugar y Carlos en tercera posición. Cuando estaban por subir al podio para recibir las medallas, se dieron cuenta de que tenían un solo par de guantes. Habían dejado el otro en el vestuario. Smith se puso el derecho y Carlos el izquierdo. Luego explicaron que esa acción representaba la pobreza negra. Smith llevaba también un pañuelo negro alrededor de su cuello ""para representar el orgullo negro"". Carlos tenía su buzo desabrochado como ""muestra de solidaridad con todos los obreros de los Estados Unidos"" y un collar que, según él, era ""para las personas que fueron linchadas o asesinadas, y nadie ha dicho una oración por ellos, por los que fueron ahorcados y por los que traían de África y arrojaron al agua"". También se llevaron una sorpresa cuando apareció el australiano y blanco, Peter Norman, a recibir su medalla de plata luciendo en el pecho la misma insignia del OPHR que llevaban sus colegas negros. Cuando comenzó a sonar el himno estadounidense, Smith y Carlos bajaron la cabeza, cerraron los ojos y realizaron el saludo del puño en alto (uno con el derecho el otro con el izquierdo), un gesto que ocupó las portadas de todos los diarios del mundo. Cuando abandonaron el podio fueron abucheados por la multitud. En una conferencia de prensa posterior, Smith justificó su acción: ""Si gano, soy americano, no afroamericano. Pero si hago algo malo, entonces se dice que soy un negro. Somos negros y estamos orgullosos de serlo. La América negra entenderá lo que hicimos esta noche"". Una parte de su plan no les había salido como tenían previsto. Brundage no estuvo presente en la ceremonia. Pero, de inmediato, lanzó su furibunda respuesta. El COI obligó a la delegación estadounidense a expulsar a los dos atletas bajo la amenaza de descalificar a todo el equipo. A pesar de que perdían a dos de sus mejores corredores para otras competencias, aceptaron la sanción para preservar al resto de la delegación y las 107 medallas que estaban ganando. Smith y Carlos fueron perseguidos por años. Recibieron todo tipo de amenazas. Por algún tiempo jugaron en equipos de fútbol americano pero después tuvieron que emplearse en trabajos de poca categoría porque nadie los quería aceptar como entrenadores. A Norman le pasó algo parecido en Australia quedando en el ostracismo por 30 años. Kim, la esposa de Carlos, no pudo soportar el acoso del FBI y terminó suicidándose. Norman murió, prematuramente, en 2006, su féretro fue transportado por sus dos compañeros negros del podio. Carlos sigue militando en organizaciones de derechos humanos y en el movimiento Occupy Wall Street. Smith se vio obligado, en el 2010, a vender su medalla para pagar deudas. ————————————————. El cierre de las Olimpíadas, el 27 de octubre, fue con una ceremonia sencilla y de gran alivio para el gobierno mexicano. A pesar de las amenazas, no hubo grandes manifestaciones en su contra. La alegría mostrada por los 5.516 atletas de 112 países que participaron de los juegos logró opacar las denuncias de torturas a las que estaban siendo sometidos los estudiantes detenidos en dependencias del Ejército. Pero la imagen que iba a perdurar por años fue la de los puños enguantados de negro. Para entonces y hasta fin de ese 68 se sucedieron algunas marchas y protestas estudiantiles, aunque ninguna trascendente. El movimiento había perdido el impulso, como todos los otros del mundo. Apenas en la Plaza Garibaldi del DF, lugar de encuentro de todos los grupos populares de mariachis, se escuchaba este corrido que se sigue cantando hasta hoy: Para que nunca se olviden las gloriosas Olimpiadas, mandó matar el Gobierno cuatrocientos camaradas.  ¡Ay! plaza de Tlatelolco, cómo me duelen tus balas cuatrocientas esperanzas a traición arrebatadas. *Gustavo Sierra (@gsierra) es autor de ""El 68, el año que marcó a fuego al mundo"". (Planeta) MÁS SOBRE ESTE TEMA: Más de 100 terroristas vuelven a las calles de Europa y ponen en alerta a las agencias de inteligencia El precio del humo",20/10/18,america/mundo,"Guantes blancos, guantes negros",https://www.infobae.com/america/mundo/2018/10/20/guantes-blancos-guantes-negros/&sa=U&ved=0ahUKEwiqp-C1-ZzeAhXLFZAKHVK_CNsQFggTMAA&usg=AOvVaw2iOqytmp2EU23NCaZoiAZs
53,True,,"Más de medio millón de personas participaron ruidosamente en ""la mayor manifestación sobre el Brexit"", este sábado en Londres para reclamar un nuevo referendo sobre el acuerdo final entre el reino y la Unión Europea, que sigue negociándose a sólo cinco meses del plazo para que el país salga de la UE. Se trata también de la mayor manifestación en el país desde la que movilizó a los británicos en contra de la guerra de Irak en 2003, se ufanó ""People's Vote"" en un comunicado, un movimiento que milita por un ""voto popular"" y que agrupa a numerosas asociaciones eurófilas. Según este movimiento, unas 570.000 personas participaron en la manifestación. La policía británica no comunicó cifras. Bajo un suave sol otoñal boreal una compacta multitud llegó por la tarde delante del Parlamento británico y a las calles de los alrededores, agitando numerosas banderas europeas y luego de haber recorrido Londres y cruzado el barrio de los ministerios. ""Parece una fiesta"", confió a la AFP Lucy Dogget, de 23 años, estudiante en Liverpool. ""Pero ésta bien podría ser la última antes de que se apaguen las luces"" con el Brexit previsto el 29 de marzo de 2019, agregó. En las pancartas las consignas eran en contra de la salida de la UE o burlándose de la incapacidad de la primera ministra conservadora Theresa May para negociar un acuerdo de divorcio con la UE. ""Detengan el Brexit"", ""El Brexit es malo"", ""Quedémonos juntos"" o ""Tengo 16 años y el Brexit me roba mi futuro"". Entre los manifestantes que llegaron a Londres desde todas partes del país transportados por más de 150 autobuses, había numerosos ciudadanos de otros países de Europa, representados por ""The3Million"", grupo de presión que defiende los intereses de los cerca de 3,4 millones de ciudadanos de otros países europeos residentes en Reino Unido La última gran marcha hacia el Parlamento británico para pedir un nuevo referéndum reunió en junio a unas 100.000 personas. Los organizadores creen además que los británicos que entonces votaron por el Brexit modificarían ahora su posición al tomar conciencia de las consecuencias reales de abandonar la UE ""Creo que la la gente se equivocó de varias maneras"", dice el empresario Peter Hancock, interrogado por la AFP, mientras anuda una bandera europea en torno al cuello de su gran perro pastor ""Queremos seguir siendo europeos"", añade su mujer Julie. ""No vemos los beneficios"" del Brexit, añade. La marcha congrega a una multitud unida en la difícil tarea de convencer a la primera ministra británica Theresa May de que convoque una segunda consulta popular sobre el resultado de sus negociaciones con Bruselas. Pese al ambiente festivo, el mensaje es grave: el Brexit que sus partidarios prometieron antes del referéndum del 23 de junio de 2016 -en el que 52% de los británicos votaron por dejar el bloque- no tiene nada que ver con el que se está negociando ahora. May inflexible La primera ministra ha dejado muy claro que no tiene ninguna intención de permitir que se vuelva a consultar a los ciudadanos sobre esta cuestión. ""Ahora quieren un segundo referéndum para volver a dirigirse al pueblo británico y decirle 'Oh lo sentimos mucho, creemos que se equivocaron'"", lanzó Theresa May el miércoles ante la Cámara de los Comunes en Westminster. ""No habrá un segundo referéndum. La gente votó y este gobierno lo llevará a cabo (al Brexit)"", enfatizó. Por su lado, los organizadores subrayan que a pocos meses del Brexit, previsto para el 29 de marzo de 2019, las negociaciones entre Londres y Bruselas están bloqueadas en especial sobre el tema de la frontera en la isla de Irlanda. Además, alegan, persiste la incertidumbre sobre la manera en que el Reino Unido abandonará la UE. La semana que viene se entregará a la Cámara de los Comunes más de 100.000 tarjetas postales denunciando el Brexit. ""Es hora de que volvamos a tomar el control"", lanzó a la multitud el alcalde laborista de Londres, Sadiq Khan, que desfiló al frente de la columna. ""Está claro que somo más"", declaró por su parte la diputada conservadora pro europea Anna Soubry. En un mensaje por video, la primera ministra escocesa, Nicolas Sturgeon, dio su apoyo a la organización de un segundo referendo, recordando que los 35 diputados del SNP (Partido independentista escocés) en Westminster votarán a favor si se plantea el tema. La idea de un nuevo referéndum ha tenido cada vez más adeptos estos últimos meses en Reino Unido, y es apoyada por varios políticos, entre ellos el ex primer ministro laborista Tony Blair. Los reproches políticos sobre cómo llegó el país a esta situación tras dos años de negociaciones están dejando a May cada vez más sola, criticada por la oposición y, sobre todo, por prominentes figuras de su propio partido. Dmitry Zaks para AFP MÁS SOBRE ESTE TEMA: Theresa May reconoció que la transición post Brexit podría ser más larga de lo planeada Las ficciones que reflejan las consecuencias del Brexit",20/10/18,america/mundo,Una masiva manifestación en Londres reclamó un segundo referéndum sobre el Brexit,https://www.infobae.com/america/mundo/2018/10/20/una-masiva-manifestacion-en-londres-reclamo-un-segundo-referendum-sobre-el-brexit/&sa=U&ved=0ahUKEwiqp-C1-ZzeAhXLFZAKHVK_CNsQFggZMAE&usg=AOvVaw3yp1-3G0X5F-zOr1VgMyRW
54,True,,"La jornada electoral del sábado en Afganistán dejó al menos 67 muertos -27 civiles, 9 miembros de las fuerzas de seguridad y 31 insurgentes- y 126 heridos en 193 ataques perpetrados en todo el país por los talibanes, que habían amenazado unas elecciones parlamentarias que llegaban con tres años de retraso. Los 193 ataques contra las fuerzas de seguridad afganas y los colegios electorales comenzaron con la apertura de los centros a las 7:00, hora local, y se extendieron hasta las 18:00, afirmó en una rueda de prensa en Kabul el viceministro de Interior, Akhtar Muhammad Ibrahimi. Los ataques incluyen un atentado suicida en Kabul, 76 acciones contra los colegios electorales en todo el país y una docena de explosiones cerca de centros electorales ""para aterrorizar a los votantes"", además de combates con las fuerzas de seguridad. Como resultado, explicó Ibrahimi, 27 civiles murieron y un centenar resultaron heridos, mientras que al menos nueve miembros de las fuerzas de seguridad fallecieron y otros 25 resultaron heridos. Además los talibanes sufrieron 31 bajas y 18 insurgentes más fueron detenidos con vida. Según el viceministro de Interior, estos ataques son cerca de la mitad de los que se produjeron en 2014 durante las elecciones presidenciales. Por su parte, en la misma rueda de prensa, un portavoz del Palacio Presidencial, Haroon Chakhansori, no dudó en calificar los comicios como ""un éxito"" para Afganistán y una ""derrota"" para los terroristas. Para garantizar la seguridad en los comicios, el Gobierno afgano desplegó en todo el país 70.000 soldados y policías, según reveló el Ministerio de Interior, lo que suponía un incremento de 16.000 efectivos respecto al anuncio de hace unos días. Mientras tanto, los talibanes habían recordado a la población que ""los centros electorales del enemigo en todo el país están bajo ataque"", por lo que pidieron a los ciudadanos que no participasen en este ""falso proceso"" si ""desean salvar sus vidas"", aseguró en un comunicado el portavoz talibán Zabihullah Mujahid. Al finalizar la jornada, otro de los portavoces talibanes, Qari Yousuf Ahmadi, aseguró en otro comunicado que habían perpetrado alrededor de 400 ataques durante toda la jornada, en los que ""decenas de soldados y policías murieron y resultaron heridos"". ""Las elecciones fracasaron"", sentenció. Previstas inicialmente para el verano de 2015 pero retrasadas a causa de la precaria situación de seguridad, la inestabilidad política y los problemas financieros, las elecciones se consideran como una prueba para la frágil democracia afgana y un test antes de los comicios presidenciales, previstos para abril de 2019. Por primera vez desde el final de la misión militar de la OTAN en 2014, el Gobierno afgano es responsable de la seguridad durante las elecciones. Con información de EFE MÁS SOBRE ESTE TEMA:  Asumió un nuevo comandante de la OTAN en Afganistán en medio de una renovada escalada de violencia terrorista",20/10/18,america/mundo,Sangrienta jornada electoral en Afganistán: al menos 67 muertos y 126 heridos,https://www.infobae.com/america/mundo/2018/10/20/sangrienta-jornada-electoral-en-afganistan-al-menos-67-muertos-y-126-heridos/&sa=U&ved=0ahUKEwiqp-C1-ZzeAhXLFZAKHVK_CNsQFggfMAI&usg=AOvVaw2FDPj-WoMGDy_UmZACEc_D
55,True,,"Las autoridades de Arabia Saudita desconocen el paradero del cuerpo del periodista disidente Jamal Khashoggi, informó una fuente cercana a la corona a la cadena CNN. El viernes, Arabia Saudita confirmó que el periodista murió en el consulado de ese país en Estambul, diecisiete días después de que su pareja denunciara su desaparición. La fuente dijo que el cuerpo fue entregado a un ""colaborador"" local después del asesinato, pero agregó que no se encuentra en el consulado saudita en Estambul. El reino difundió el viernes su versión sobre el episodio tras una investigación preliminar, según la cual el periodista murió como consecuencia de una pelea en el interior del consulado, cuando iba a retirar un documento. La corona saudita informó, además, que 18 ciudadanos sauditas han sido arrestados, y que el asesor de la Corte Real Al Qahtani y el subjefe de inteligencia Ahmed Asiri fueron despedidos de sus puestos. Por su parte, la Agencia Saudita de Prensa (SPA, por sus siglas en inglés) informó que el rey Salman ordenó la formación de un comité ministerial a cargo del Príncipe heredero Mohamed bin Salman para reestructurar la agencia de inteligencia. Khashoggi poseía la residencia permanente en los Estados Unidos y era columnista del diario Washington Post. Su prometida denunció que el 2 de octubre pasado había ingresado al consulado saudita en Estambul con el objetivo de obtener un documento necesario para contraer matrimonio y nunca había salido de allí. El episodio generó fuertes cuestionamientos sobre la corona saudita de parte de Estados Unidos y los países europeos, por presuntamente no colaborar con la investigación como le exigían. La mayoría de los sospechosos en la desaparición del periodista señalados por Turquía durante estos 17 días tenían fuertes vínculos con el príncipe heredero Mohamed bin Salmán, señalado como un reformista en el reino. Tras la confirmación de la muerte por parte de Arabia Saudita, Estados Unidos se manifestó ""entristecido"", y Donald Trump dijo que las explicaciones de su aliado eran ""creíbles"". La canciller Angela Merkel, por su lado y a todo con el resto de los líderes europeos, consideraron la versión saudita de ""insuficiente"" y pidieron una investigación independiente. MÁS SOBRE ESTE TEMA:  Turquía prometió ""revelar lo que sea que ocurrió"" sobre la muerte del periodista Jamal Khashoggi",20/10/18,america/mundo,Arabia Saudita dice que no sabe dónde está el cuerpo del periodista disidente Jamal Khashoggi,https://www.infobae.com/america/mundo/2018/10/20/arabia-saudita-dice-que-no-sabe-donde-esta-el-cuerpo-del-periodista-disidente-jamal-khashoggi/&sa=U&ved=0ahUKEwiqp-C1-ZzeAhXLFZAKHVK_CNsQFgglMAM&usg=AOvVaw3-cnglTi8v2MCBZ4zza00u
