,abierta_comentarios,autor,cuerpo,fecha,seccion,titulo,url
30,True,Juan Gasalla,"A diferencia de la caída generalizada en la mayoría de las actividades de la economía, la industria de la construcción registró en agosto último una suba marginal del 0,1% comparada con igual mes del 2017 y acumula en el año un aumento del 7,9 por ciento. Si bien se trata de la tasa de expansión más baja de los últimos trece meses, la realidad es que exhibir números positivos destaca frente a caídas en torno al 4 y 5 por ciento en la comparación interanual de muchos rubros. Según informó el INDEC, el Indicador de Coyuntura de la Actividad de la Construcción (ISAC) registró un aumento del 2,7% en agosto, en la comparación con el mes anterior. Tras la suba interanual de mayo pasado del 7%, la industria de la construcción permanece virtualmente estancada, ya que en junio había caído un 0,1% y en julio creció un 0,7%, apenas por encima del indicador de agosto en la medición interanual. Un aspecto central está vinculado con la naturaleza del negocio, pues las obras se realizan en pesos, pero se comercializan en dólares. Con un mercado inmobiliario en el que cayó el número de las operaciones pero no los precios de venta en la misma proporción, se produjo una apreciable brecha entre el costo de construcción del metro cuadrado y el valor de venta en dólares. El INDEC informó que los precios de la industria de la construcción crecieron 7,3% en septiembre, la variación más alta en casi dos años y medio, y acumularon en lo que va de 2018 un incremento del 32,5%, en línea con el indicador de precios minoristas, que fue del 32,4 por ciento. En los últimos doce meses, el costo de la construcción llega al 36%, por debajo del 40,5% de la evolución de los precios minoristas en ese período. Según el Índice del Costo de la Construcción en la Ciudad de Buenos Aires, elaborado por la Dirección General de Estadística y Censos porteña, el incremento acumulado entre enero y septiembre fue de 43,1%, medido en pesos, por encima de la inflación en el período próxima a 32 por ciento. El costo de la construcción en la Ciudad tuvo en septiembre el aumento porcentual más alto desde que se cuentan con registros oficiales en el distrito, con un 10,5% mensual y un 46,4% interanual. Pero frente a un dólar que se encareció un 121% entre enero y septiembre –de $18,92 a $41,87-, el costo de la construcción medido en moneda norteamericana se redujo 35,3% en los primeros nueve meses de 2018. ""Desde nuestro punto de vista la devaluación impactó positivamente en el sector porque el valor del costo de construcción en dólares es muchísimo más accesible y, quienes tienen dólares, se animan a invertirlos en una propiedad. A su vez, los materiales no han aumentado al ritmo de la devaluación, así como la mano de obra tampoco ha aumentado en el porcentaje que se ha devaluado"", comentó Sebastián Fulgueira, vicepresidente de la constructora ECLOSA. Un informe de la consultora especializada Reporte Inmobiliario coincidió con esta tendencia. La consultora especializada detectó que los costos construcción en dólares cedieron un 35,4% en 2018, dinámica que incidió en una baja de los valores reposición, aunque todavía esto no se reflejó en una caída de los precios de mercado en la oferta a estrenar. En una comparación interanual, ""luego de haber llegado a los USD 1.191 para cada metro cuadrado vendible en septiembre del año pasado, el costo se redujo hacia fines del mismo mes de este año en un 38,5% debido a al incremento diferencial sufrido por los costos en pesos y el de la cotización del dólar"", indicó. Reporte Inmobiliario calculó los costos de construir un edificio entre medianeras en la Ciudad de Buenos Aires, que se ubicó en unos USD 732 por metro cuadrado vendible, a lo que hay que sumarle una serie de ítem, como honorarios, publicidad y marketing, beneficio de los emprendedores y valor de la tierra para el desarrollo. Por eso, el llamado ""costo de reposición"" –a qué precio vender para poder financiar un nuevo desarrollo de las mismas características- alcanza hoy los USD 2.200 por metro cuadrado, en promedio en Ciudad de Buenos Aires, cuando la cotización promedio del metro cuadrado a estrenar en el distrito porteño es de USD 3.100. Esta brecha que da margen para aplicar un ajuste de los precios en los próximos meses, en un mercado en franca desaceleración. Un informe de la Universidad Di Tella, dirigido por el economista Juan José Cruces, detectó que con un valor promedio de USD 3.105 por metro cuadrado, las propiedades en la ciudad de Buenos Aires son las segundas más caras de la región, detrás de Santiago de Chile (USD 3.272), y por encima de Montevideo (USD 3.080) y Río de Janeiro (USD 2.886). El informe de la UTDT, en base a las cotizaciones de mercado publicadas por ZonaProp, refleja que el metro cuadrado en Buenos Aires se apreció 0,4% en dólares, y un 60,6% en pesos, en términos reales, descontando el efecto de la inflación-. En Rosario las propiedades cedieron 2,6% en dólares y aumentaron 55,8% en pesos (USD 1.752 por metro cuadrado). En Córdoba, el incremento fue de 50,5% en pesos, pero con una baja real de 5,9% en divisa norteamericana  (USD 1.661). Los costos actuales, según el cálculo de Reporte Inmobiliario, están en su nivel más bajo en una década, si se exceptúan los mínimos de enero y julio de 2014, con un dólar ""blue"" o marginal que se pagaba más de 40% por encima del oficial, de venta restringida por el ""cepo"" cambiario. En el mismo sentido, Reporte Inmobiliario señaló que los costos para construir una vivienda tipo Country o Barrio Privado de perímetro libre bajaron 35,9% en dólares desde el pico de noviembre del año pasado. EXPECTATIVAS DE ESTANCAMIENTO Está claro que la actividad de la construcción no es ajena al contexto. Con una economía que se contrae y no muestra un horizonte de despegue en lo inmediato, las expectativas sectoriales son pesimistas para los próximos meses, aunque la relación de costos en pesos y ventas en dólares es un aliciente para la actividad y amortigua los golpes que asestan la recesión y la inflación. Según la última encuesta cualitativa del INDEC, los permisos de construcción para la ejecución de obras privadas en los 60 municipios más importantes del país tuvieron en agosto una suba de 0,6% con relación a julio, pero una baja del 15,5%, con respecto al mismo mes del año anterior. Las solicitudes autorizadas, que permiten anticipar el ritmo de la actividad en el corto plazo, acumularon en los ocho primeros meses del año una baja de 9,5%, con respecto al mismo período del año anterior. Sebastián Fulgueira, de ECLOSA, destacó que en el ámbito público hay grandes posibilidades para el sector.  ""Actualmente las obras públicas se encuentran en un escenario muy sano porque existen licitaciones en la provincia de Buenos Aires con valor de pliegos accesibles o sin cargo, lo que permite mayor cantidad de oferentes, lo cual hace que los precios no se eleven. Se ve una gran cantidad de empresas participando de licitaciones, tanto privadas como públicas, se está elevando el nivel y la calidad solicitada con materiales de primeras marcas o los que más garantía otorguen"", refirió. No obstante, el 63,6% de las empresas que realizan obras privadas y el 77,8% de las que se dedica a la obra pública estimaron que el nivel de actividad caerá durante los próximos tres meses, según el relevamiento del INDEC, con lo que se podría decir que la construcción terminará con crecimiento nulo en 2018, en el cotejo entre puntas. Es un resultado para ponderar si se toma en cuenta que el ministro de Hacienda, Nicolás Dujovne, estimó en el proyecto de Presupuesto que la economía caerá 2,4% este año. El Fondo Monetario Internacional (FMI) calculó que la caída del PBI será de 2,6 por ciento.",20/10/18,economia,Por qué la construcción es el sector que mejor respondió a la devaluación,https://www.infobae.com/economia/2018/10/20/por-que-la-construccion-es-el-sector-que-mejor-respondio-a-la-devaluacion/&sa=U&ved=0ahUKEwiCm4ud-ZzeAhWEhZAKHf7KAy0QFggTMAA&usg=AOvVaw2zEvY36KYIQ_iOpbTBCYgR
31,True,,"Con los ojos del mercado puestos sobre la reunión del directorio ejecutivo del FMI este viernes, el Gobierno abrirá la semana con una presentación de los números fiscales correspondiente al cierre del tercer trimestre del año. El período julio-septiembre se distinguió por fuertes subas en el tipo de cambio, aceleración  de la inflación y fuerte recesión, con arrastre para los siguientes meses, pero se espera que la conferencia de prensa en el Ministerio de Hacienda oficialice la tendencia positiva de la recursos y la contención del gasto público. El sobrecumplimiento de las metas fiscales era casi una certeza de cara a fin de año en las últimas presentaciones del ministro de Hacienda, Nicolás Dujovne, principalmente motivado por la subejecución de los fondos presupuestados. Es decir, el Gobierno viene sobrecumpliendo con sus metas fiscales más por un recorte en el gasto público que por un aumento en el ingreso tributario, que en la última presentación reflejó una dependencia en saltos extraordinarios. En el primer semestre del año, el déficit primario, dato de referencia del Gobierno por encima del total, mostró una caída interanual del 26,7%. En aquel entonces, el ministro Dujovne recordó que la cifra de déficit de 1,9% del PBI marcaba que ""por sexto trimestre consecutivo Argentina cumple las metas fiscales, que nos van a conducir al equilibrio fiscal en 2020"". Desde entonces, la situación económica empeoró y llevó a cambiar las metas. El Gobierno ahora apunta a cumplir con el objetivo de equilibrio fiscal en 2019 mientras aspira a cerrar este año con un déficit no mayor a 2,6% del PBI. Una de las vías para lograrlo que se consignan desde el Gobierno, además de recurrir a medidas adicionales de recortes en el gasto presupuestado y mayor recaudación usando medidas como retenciones a las exportaciones, es que no todo el gasto presupuestado sea finalmente ejecutado. La tendencia que probablemente será presentada este lunes se puede ver en la página de Presupuesto Abierto del Ministerio de Hacienda, en la que se refleja una ejecución del 75,55% del gasto presupuestado para el año (presupuesto que fue modificado en $152.800 millones desde el aprobado inicialmente). El sitio también indica que la evolución de ingresos fiscales mantiene un ritmo más elevado que el de los gastos, al ya haberse recaudado un 84,83% de lo planeado. Las jurisdicciones de Gobierno, que el sitio todavía no actualizó para reflejar el cambio en organigrama en el cual se modificó a ciertas carteras a Secretarias de Estado, que más aportaron al ritmo actual de ejecución fueron los ministerios de Finanzas (53,97% del gasto ejecutado por ahora), Turismo (54,43%) y la Jefatura de Gabinete (54,78%). Con un 80% del año ya pasado, el progreso de las variables indica que el Gobierno se encuentra en camino a cumplir con las metas de déficit fiscal. Las mismas apuntan al aspecto primario, es decir, no contemplan el aspecto financiero de los pagos de intereses de deuda. Ese aspecto preocupa a algunos economistas que notan que los servicios de deuda deberían ser contemplados ya que eventualmente los pagos de intereses repercuten en los fondos estatales. El diferencial entre el gasto presupuestado y la recursos totales esperados, proyecta que el Gobierno necesitaría más del equivalente a 4 meses de ingresos por todo concepto para hacer frente al déficit financiero, el cual es alimentado por los abultados pagos de deuda. El calculo se condice con la información oficial, ya que el asiento de ""Servicios de la Deuda Pública"" lidera la marcha de jurisdicciones que más cerca está de su monto presupuestado. Sin embargo, el aspecto primario, enfoque principal del Gobierno y del FMI, parece estar encaminado y se espera que los datos presentados este lunes vayan en la misma línea que los comunicados en los últimos meses, de modo de no trabar el Acuerdo II con el Fondo Monetario Internacional el próximo viernes. Al 17 de octubre la brecha entre los gastos totales ejecutados de $2,29 millones y los recursos totales registrados de $1,89 billones, se redujo al equivalente a 2,5 meses de ingresos.",20/10/18,economia,El Gobierno presentará datos de resultado fiscal antes de la aprobación del nuevo acuerdo con el FMI,https://www.infobae.com/economia/2018/10/20/el-gobierno-presentara-datos-de-resultado-fiscal-antes-de-la-aprobacion-del-nuevo-acuerdo-con-el-fmi/&sa=U&ved=0ahUKEwiCm4ud-ZzeAhWEhZAKHf7KAy0QFggZMAE&usg=AOvVaw0YqWb2wDCd42EM4mzI1wwE
32,True,,"El Coloso Marcelo Bielsa celebró su segunda victoria en el campeonato: Newell's se impuso sobre el debilitado Tigre 2-0 y tomó aire en la lucha por la permanencia que lo aqueja. La ""Lepra"" arrancó arriba en el marcador cuando promediaba la primera etapa gracias a la combinación defensiva de Mariano Bittolo y Fabricio Fontanini: el lateral ejecutó un tiro libre desde la izquierda y el marcador central ganó bien de arriba para cruzar el cabezazo al gol. En el complemento, los de Omar De Felippe ejecutaron una contra a la perfección: Luis Leal fue el encargado de clarificar el panorama con una media vuelta fenomenal en la mitad de la cancha que habilitó a Héctor Fértoli, quien avanzó con pelota dominada y la colgó del ángulo para sellar el 2-0. Los rosarinos, que esperan por el duelo de Copa Argentina ante Rosario Central, suman 8 puntos tras sumar su segunda victoria en el certamen tras acumular dos empates y cuatro derrotas. En Victoria la situación apremia: con dos triunfos en el torneo, marchan en la anteúltima posición de la tabla de promedios y hoy estarían marchándose al descenso con Belgrano, Patronato y San Martín de Tucumán. Estadio: Coloso Marcelo Bielsa. Árbitro: Andrés Merlos. Tabla de posiciones:",20/10/18,deportes-2,Newell's venció a Tigre en Rosario y lo hundió en la zona de descenso,https://www.infobae.com/deportes-2/2018/10/20/newells-vs-tigre-fecha-9-superliga-2018/&sa=U&ved=0ahUKEwiNi9Ch-ZzeAhWGF5AKHUX5CW8QFggTMAA&usg=AOvVaw2ilLlxPAVSKrUyfwByniJE
33,True,,"Lanús se hizo fuerte de local y ganó por primera vez en lo que va de la Superliga. Nueve fechas tardó en llegar el éxito para ""El Granate"", que se impuso por 3-1 ante Patronato de Paraná. El equipo de Luis Zubeldía fue superior a su rival y encaminó el triunfo con el gol de Sebastián Ribas, a los 12 minutos del primer tiempo. El delantero hizo valer la ""Ley del ex"" al cabecear ante la floja salida del arquero Sebastián Bértoli en un tiro libre ejecutado por Nicolás Pasquini. Los locales iban a volver a golpear en un momento clave. Al minuto del complemento, otra vez luego de una pelota parada, Damián Lemos convirtió en contra de su propia valla y selló el 2-0. La ilusión se encendió para Patronato a los 14, cuando Mauricio Sperdutti logró el descuento al definir con una pirueta un centro que le habían bajado en el segundo palo. Sin embargo, sobre los 32', José Luis Sinisterra llevó tranquilidad a Lanús y selló el 3-1 que dejó los tres puntos en el Sur. Lanús no había ganado en el torneo. Hasta el momento, cosechaba un total de tres empates y cinco caídas.Con este triunfo llegó a seis puntos en la tabla y abandonó el último puesto. Además, la victoria le permite al equipo de Zubeldía tomar algo de aire en la lucha por la permanencia. Para Patronato el panorama es más complicado. Los dirigidos por Mario Sciaqua solo ganaron un partido en el torneo. De los restantes, empataron uno y perdieron siete. Están ubicados en zona de descenso y deben comenzar a sumar con urgencia para intentar quedarse en la máxima categoría del fútbol argentina en la próxima temporada. Formaciones: Lanús: Matías Ibáñez; Leonel Di Plácido, Nicolás Thaller, Marco Torsiglieri, Nicolás Pasquini; Tomás Belmonte, Facundo Quignon, Marcelino Moreno; Pedro De La Vega, Sebastián Ribas y Lautaro Acosta. DT: Luis Zubeldía. Patronato: Sebastián Bértoli; Lautaro Geminiani, Walter Andrade, Renzo Vera, Nicolás Pantaleone; Abel Peralta, Damián Lemos, Gabriel Carabajal, Lautaro Comas; Nicolás Royón y Facundo Barceló. DT: Mario Sciacqua. Estadio: Ciudad de Lanús Néstor Díaz Pérez. Árbitro: Julio Barraza. Fixture: Tabla de posiciones: LEA MÁS EN INFOBAE DEPORTES",20/10/18,deportes-2,Lanús ganó por primera vez en la Superliga: superó a Patronato en un duelo clave por el descenso,https://www.infobae.com/deportes-2/2018/10/20/lanus-patronato-fecha-9-superliga-argentina-2/&sa=U&ved=0ahUKEwiNi9Ch-ZzeAhWGF5AKHUX5CW8QFggZMAE&usg=AOvVaw36O3U_Jq88Ih67zT1YlQk-
34,True,,"Godoy Cruz volvió a sonreír. ""El Tomba"" dejó atrás una seguidilla negativa de tres derrotas consecutivas y le ganó por 2-0 a Aldosivi en condición de local por la novena fecha de la Superliga del fútbol argentino. ""El Tomba"" tuvo un buen rendimiento general y doblegó a un rival que venía en alza y con aspiraciones de dar pelea en lo más alto de la tabla. En la primera parte, los dirigidos por Diego Dabove tuvieron la opción más clara para ponerse en ventaja con un cabezazo de Victorio Ramis a la salida de un córner que se fue apenas desviado. Ya en el complemento, Godoy Cruz iba a desnivelar. A los 13 minutos, Valentín Burgoa, en una gran acción individual, enganchó ante un defensor y remató desde afuera del área para sellar el 1-0. Ángel González liquidó el pleito sobre los 33' al marcar el 2-0. Aldosivi se fue desesperado en busca del descuento sobre el final, pero ya no puedo vencer al arquero Roberto Ramírez y se llevó una derrota de su viaje a Mendoza. ""El Tomba"" resurgió después de tres caídas y suma 13 puntos en la tabla de posiciones. En tanto que Aldosivi -con Gustavo Álvarez como DT-, que tenía la gran ilusión de quedar como escolta de Racing, sigue con 15 unidades, a cinco de ""La Academia"". Formaciones: Estadio: Malvinas Argentinas. Árbitro: Ariel Penel. Fixture: Tabla de posiciones: LEA MÁS EN INFOBAE DEPORTES",20/10/18,deportes-2,Godoy Cruz salió de su mal momento con una victoria ante Aldosivi,https://www.infobae.com/deportes-2/2018/10/20/godoy-cruz-aldosivi-fecha-9-superliga-argentina-2018/&sa=U&ved=0ahUKEwiNi9Ch-ZzeAhWGF5AKHUX5CW8QFggfMAI&usg=AOvVaw0iD1X_iJhi3rHL1Sykb5bY
35,True,,"Boca se presentó en el Alberto J Armando con la cabeza puesta en la Copa Libertadores. El objetivo de sacar un resultado favorable en la primera semifinal ante Palmeiras motivó a Guillermo Barros Schelotto de formar un mix entre titulares y suplentes. La solidez que caracteriza al estilo de Edgardo Bauza fue una complicación extra para el Xeneize, ya que la gestación creativa que estaba en los pies de Cardona, Zárate, Almendra, Benedetto y Villa no representaba ningún peligro para Rosario Central. Durante la primera etapa la visita tuvo las acciones más claras para ponerse en ventaja. Las intervenciones de Washington Camacho y Fernando Zampedri significaron una amenaza constante para Agustín Rossi, quien demostró solidez en cada respuesta del ataque rosarino. A pesar de la disconformidad por la producción expuesta en el primer tiempo, el Mellizo decidió esperar para realizar las variantes y envió a los mismos once para que reanuden el pleito, apostando a que los gritos del vestuario hagan reaccionar a los protagonistas boquenses. Los envíos aéreos del >Colorado Gil complicaron constantemente a la defensa local, mientras que los contragolpes liderados por el colombiano Villa no eran aprovechados por el combinado xeneize. Como Boca careció de ideas, la pelota parada fue el recurso más empleado para llegar al gol, pero el bajo nivel de Zárate y Benedetto atentaba contra el objetivo del Mellizo. A pesar del calor de la gente, en la Bombonera había preocupación por el pésimo andamiaje de los hombres que vistieron la azul y oro. Con las dos chances que desperdició Rosario Central en el final, hubiera sido una injusticia si Pablo Pérez hubiese convertido la última acción del espectáculo. ""Si me dan 20 pelotas, meto las 20, pero hoy no quiso entrar"", dijo el volante, quien se retiró molesto por la repartición de puntos. Con 15 unidades en 9 partidos, los de Barros Schelotto desperdiciaron la oportunidad de presionar a Racing, dado que la Academia debe jugar frente a San Martín de Tucumán en la Ciudadela. En caso de conseguir una victoria, la distancia del elenco del Chacho Coudet con Boca será de 8 puntos. Sin dudas, los del Mellizo deberán mejorar su imagen si desean llegar a la final del certamen más codiciado del continente. LEA MÁS EN INFOBAE DEPORTES",20/10/18,deportes-2,"Boca jugó mal, sufrió con Rosario Central y empató en la Bombonera",https://www.infobae.com/deportes-2/2018/10/20/boca-rosario-central-fecha-9-superliga-argentina-2018/&sa=U&ved=0ahUKEwiNi9Ch-ZzeAhWGF5AKHUX5CW8QFgglMAM&usg=AOvVaw3-qcqIClldt2jmnspCaWs6
36,True,,"Diego Armando Maradona sigue mostrando su gran momento como DT en el ascenso mexicano al mando de los Dorados de Sinaloa: se impuso 3-2 en condición de visitante sobre los Mineros de Zacatecas, equipo que marcha en la tercera colocación de la tabla. El ""Diez"", que debió usar un bastón para trasladarse por el Estadio Carlos Vega Villalba a raíz de los problemas que lo aquejan en sus rodillas, celebró gracias al doblete del ecuatoriano Vinicio Angulo y el tanto del mexicano Jesús Escoboza. El partido, correspondiente a la 12ª fecha del ascenso MX significó la quinta victoria de Maradona en siete partidos como DT de los de Sinaloa (dos derrotas). Gracias a este triunfo, Dorados alcanzó los 15 puntos y subió un puesto en la tabla: está séptimo y clasificando a la fase final por el ascenso, a falta de tres fechas para el cierre. Los de Sinaloa suman dos puntos más que Potros UAEM (8°) y tres más que Zacatepec y Correcaminos UAT. Tras este partido, quedarán tres fechas más para los de Diego: Tampico Madero de local (27/10), Venados de visitante (3/11) y Atlético San Luis en casa (11/11).",20/10/18,deportes-2,El Dorados de Maradona ganó un partido clave de visitante y da pelea por el ascenso,https://www.infobae.com/deportes-2/2018/10/20/dorados-diego-maradona-mineros-de-zacatecas-fecha-12-ascenso-mx/&sa=U&ved=0ahUKEwiNi9Ch-ZzeAhWGF5AKHUX5CW8QFggrMAQ&usg=AOvVaw25qMk36UBS2ltYbFhy1CGo
37,True,,"Luego de un sábado de lluvias intermitentes, el Servicio Meteorológico Nacional (SMN) prevé para este domingo un poco de sol y una temperatura máxima de 23 grados en la Ciudad y la provincia de Buenos Aires. Según el pronóstico extendido, las lluvias que se registran este sábado disminuirán hacia la noche, por lo que el cielo estará parcialmente nublado a nublado y habrá vientos moderados a leves del sector este. Para mañana, jornada en que se festeja el Día de la Madre, en el Área Metropolitana se esperan temperaturas que oscilarán entre los 15 y los 23 grados, con nubosidad variable y vientos leves del noreste, por lo que el sol saldrá de a ratos.",20/10/18,sociedad,Cómo estará el clima en el Día de la Madre,https://www.infobae.com/sociedad/2018/10/20/como-estara-el-clima-en-el-dia-de-la-madre/&sa=U&ved=0ahUKEwiJm7-m-ZzeAhWCI5AKHdpdCSkQFggTMAA&usg=AOvVaw2tnWGAKugSfgQO3v7IxrkS
