,fecha,likes,nota_id,nota_url,respuestas,texto,usuario,es_respuesta
2330,00:07 25/09/2018,2.0,25,https://www.lanacion.com.ar/2175245-atacan-bombas-molotov-sede-gendarmeria-nacional-san,0,"Hay que darles martires a los cimarrones , total nadie los a a extrañar ",ricardomanantial,False
2395,23:55 24/09/2018,2.0,25,https://www.lanacion.com.ar/2175245-atacan-bombas-molotov-sede-gendarmeria-nacional-san,0,@etacarinae88 @ricardomanantial Yo pensaba con los cimarrones dentro,ricardomanantial,True
2424,23:47 24/09/2018,4.0,25,https://www.lanacion.com.ar/2175245-atacan-bombas-molotov-sede-gendarmeria-nacional-san,0,"94 millones Maximosin hacer nada, jajajajaja podria donar algo a los cimarrones de la plaza no?",ghriva,False
2425,23:47 24/09/2018,4.0,25,https://www.lanacion.com.ar/2175245-atacan-bombas-molotov-sede-gendarmeria-nacional-san,1,Quieren dos cimarrones como Kosteki y Santllan ,ricardomanantial,False
2869,22:24 24/09/2018,1.0,25,https://www.lanacion.com.ar/2175245-atacan-bombas-molotov-sede-gendarmeria-nacional-san,0,"@ccmaxima @lmrosario Milani, tu milico bueno, escoria K.",AndersB,True
2897,22:22 24/09/2018,,25,https://www.lanacion.com.ar/2175245-atacan-bombas-molotov-sede-gendarmeria-nacional-san,0,"@ccmaxima @cheroke1 Vas a correr como en 1955 o como en 1976, escoria K?",AndersB,True
2959,22:04 24/09/2018,4.0,25,https://www.lanacion.com.ar/2175245-atacan-bombas-molotov-sede-gendarmeria-nacional-san,0,Estas bestias son guerrilleros terrorristas y las autoridades deberian de actuar y aplicar toda la ley a full.  ,arusany,False
3758,14:54 25/09/2018,,30,https://www.lanacion.com.ar/2175221-a-89-anos-prestigioso-matematico-asegura-haber,0,"@guepardo Hay que seguir la conversación y prestar atención al contexto antes de responder. Los números enteros están contenidos dentro de ""eje de los reales"" (no dentro del semieje positivo, que sí incluye a todos los naturales, ni dentro del plano de los complejos). Mi comentario venía a cuenta del que antes había hecho orbifold. ",Diego456,True
3759,15:54 25/09/2018,1.0,30,https://www.lanacion.com.ar/2175221-a-89-anos-prestigioso-matematico-asegura-haber,0,"@Diego456 @guepardo En álgebra abstracta, se definen números primos generalizados (o ""ideales primos"") en sistemas algebraicos conocidos como anillos conmutativos. El conjunto de los números enteros es un ""anillo"", el de los naturales no lo es. De ahí que muchas veces definen a un número primo dentro de los enteros.",orbifold,True
5674,02:07 28/09/2018,1.0,98,https://www.lanacion.com.ar/2176195-el-gobierno-elimina-aranceles-importacion-productos-tecnologicos,0,Claro vota al macrismo que va dejar 30millones de pobres. De donde salen ustedes? Del Newman salen tan bestias?,sebastian877,False
6748,16:57 27/09/2018,,99,https://www.lanacion.com.ar/2176184-pobreza-indigencia-indec,3,"@republicaonada   Y para colmo los que vienen de Venezuela son buenos,  son mejores a los marrones de acá.",oscarbr,True
6955,21:08 27/09/2018,,102,https://www.lanacion.com.ar/2176239-una-turista-murio-aplastada-elefante-durante-safari,0,"@coordinador35 No, justamente los safaris y la industrai del turismo es lo único que puede salvar a elefantes, leones, leopardos, tigres, rinocerontes, etc  de la extición total. Se los caza por su piel, cuernos dientes, medicina tradicional china, trofeos, etc. Y pagan bastante dinero por cada animal, en países extremadamente pobres esos es una fuerte tentación. La industria del Turismo y los safaris (que no deben por supuesto ser invasivos) generan fuentes de trabajo genuinas y mueven mucho dinero, el cual sirve de paliativo y alternativa a lo antes mencionado. El tema es que estamos hablando de animales salvajes, siempre peligrosos, los accidentes ocurrieron, ocurren y ocurrirán. Yo también desearía que viviesen sin injerencia humana alguna, pero no es viable. En este caso, es la mejor solución posible. Lo que es necesaris es tener sentido común: no bajarse de los vehículos, no comprar marfil, no pagar por una cacería enlatada (busquen ""canned hunting"", en Argentina lamentablemente también existe).",AfrikaT,True
7506,23:18 27/09/2018,4.0,112,https://www.lanacion.com.ar/2176224-mauricio-macri,0,"Estàn con pànico los cimarrones, no tienen candidato ni partido Ja!Ja!Ja! ",nesfer24,False
9357,18:30 28/09/2018,,127,https://www.lanacion.com.ar/2176595-la-compania-larga-distancia-flechabus-se-presento,0,"@DOMINOR1 @luis_lab estas bestias festejan que un servicio público deje de funcionar, que la gente no pueda viajar y que otras personas se queden sin trabajo...... por suerte por ahora esto no ocurre, flechabus seguirá operando pero...... esta como racing en su momento, feo momento.",flaviopi,True
10515,23:41 28/09/2018,2.0,142,https://www.lanacion.com.ar/2176637-mauricio-macri-critico-agresiones-recibio-pareja-visito,0,"prefiero pagarte un plan a darte un trabajo, asi me aseguro que siempre estes bajo la suela pardo...",TheDuke2009,False
11285,18:10 29/09/2018,,156,https://www.lanacion.com.ar/2176898-nicolas-dujovne-no-tengo-miedo-no-se,2,"Pobres cimarrones, Porota se choreo un PBI y ellos ahora pagan Ja!Ja!Ja! ",nesfer24,False
11332,18:09 29/09/2018,,156,https://www.lanacion.com.ar/2176898-nicolas-dujovne-no-tengo-miedo-no-se,0,@omargutierrez @nesfer24 Hay perros cimarrones y peron chos cimarrones,nesfer24,True
11353,17:59 29/09/2018,4.0,156,https://www.lanacion.com.ar/2176898-nicolas-dujovne-no-tengo-miedo-no-se,1,"Los cimarrones entraron en pànico, hay abstinencia al choreo",nesfer24,False
13257,21:45 29/09/2018,4.0,178,https://www.lanacion.com.ar/2176929-fito-paez-hablo-kirchnerismo-nueva-york-nunca,2,"En Europa, Viena, Londres, Ginebra, Milán, Praga, se dan conciertos públicos que erizan la piel. Aquí estos chantas desafinados sin conocimientos de música son pagados para que aúllen al compás de la pobre sociedad embrutecida. Y los políticos populistas, contentos, porque piensan conseguir votos. Pagamos nos, de nuestros impuestos para que las bestias sigan existiendo.",fumenoire,False
14801,22:18 30/09/2018,2.0,201,https://www.lanacion.com.ar/2177171-docentes-hicieron-fiesta-escuela-moreno-cerrada-explosion,0,@otro22 dejo como siembra estas escorias que de personas y valores no tienen nada.Ademas siendo docentes que verguenza por favor prestarse para esto.,angel19495,True
14865,03:01 01/10/2018,1.0,202,https://www.lanacion.com.ar/2177179-juan-carlos-schmid-renuncio-al-triunvirato-cgt,0,hasta de robar les da fiaca a estos pardos,relajateygoza1,False
15547,00:37 01/10/2018,1.0,206,https://www.lanacion.com.ar/2177138-a-partir-manana-buenos-aires-estara-sitiada,0,si igual los marrones nos cortan a diario las calles...,rosa4427,False
16190,14:24 30/09/2018,8.0,209,https://www.lanacion.com.ar/2177120-peaje-muerte-discusion-tiro-arma-pelea-autopista,0,"Un milico con mente de milico. Un animal. Los milicos han sido parte importante en lo que nos pasa como pais.
Peron y otros bestias como el nos gobernaron por mas de 25 años.
Ademas peron una bestia mas bestia creó el peronismo que nos terminó de fundir",MabelZunino,False
16337,11:59 30/09/2018,,209,https://www.lanacion.com.ar/2177120-peaje-muerte-discusion-tiro-arma-pelea-autopista,1,"Desde hace décadas, las FF.SS. están conformadas por pardos y mestizos, allí están los resultados ",estevita,False
17920,15:57 01/10/2018,,223,https://www.lanacion.com.ar/2177357-chile-bolivia-disputa-salida-al-mar-corte,4,"@maria_emilia_sol ¡Apa! Se chivó la maría emilia, tranqui, che, bolivia, chile segual.
¿Cuál vendría a ser la diferencia, son todos marrones?",fjcaldera,True
18532,12:40 01/10/2018,1.0,223,https://www.lanacion.com.ar/2177357-chile-bolivia-disputa-salida-al-mar-corte,3,Porque ARGENTINA tiene que soportar LA ESCORIA de EXTRANJEROS,ravila3,False
18716,12:12 01/10/2018,3.0,223,https://www.lanacion.com.ar/2177357-chile-bolivia-disputa-salida-al-mar-corte,2,La gran escoria latina. Chile. Por eso no los quiere nadie.,Afro_diita,False
19070,19:01 01/10/2018,1.0,231,https://www.lanacion.com.ar/2177450-atropello-mato-uno-ladrones-intento-asaltarlo-plena,0,"@obvius @utongo no importa el color, cuando menciona negro,  pardo o marrón se refiere al color del alma,  el cuerpo puede pertenecer a un  rubio de ojos claros,hay muchos blancos y rubios hablando guaraní y especialistas en acuchillar,   la conducta es  oscura. ",luisa22,True
21038,20:29 02/10/2018,7.0,265,https://www.lanacion.com.ar/2177731-carrio-denuncia-proscripcion-porque-peronismo-bloqueo-comision,0,"@QuiqueLaNacion volvé a la bolsa de basura donde vivís, escoria.",smr1967,True
23332,19:58 04/10/2018,5.0,325,https://www.lanacion.com.ar/2178504-corcho-rodriguez-reconocio-haber-cobrado-u35-millones,1,Estas Escorias y la vida  de principes que llevan son los que funden las Pymes Argentinas.,legatto,False
24039,23:40 04/10/2018,,327,https://www.lanacion.com.ar/2178599-las-24-horas-de-vertigo-de-garavano-de-la-renuncia-al-respaldo-de-macri,0,Hincha por DEPORTIVO TÁCHIRA... VENECO PARDO MULATO.. 😁,torno10,False
25173,01:26 06/10/2018,,351,https://www.lanacion.com.ar/2178978-mauricio-macri-cierre-del-b20-la-transparencia,1,"Globertos, a pagar impuestos, tarifazos, a sufrir tasas marcianas, inflación descontrolada, endeudamiento récord, desocupación ídem, corrupcion de guante blanco, bicicletas financieras, ineptitud, marchas y contramarchas, ineptitud, vagancia. Traguen su veneno, bestias irredentas. Inanes ignorantes.",GorejDemian,False
25241,01:20 06/10/2018,5.0,351,https://www.lanacion.com.ar/2178978-mauricio-macri-cierre-del-b20-la-transparencia,5,"Los cimarrones entraron en pànico, saben que no vuelven màs! ",nesfer24,False
25368,01:04 06/10/2018,4.0,351,https://www.lanacion.com.ar/2178978-mauricio-macri-cierre-del-b20-la-transparencia,2,PERONISMO = CIMARRONES,nesfer24,False
27186,21:04 06/10/2018,2.0,382,https://www.lanacion.com.ar/2179233-carrio-indignada-cambio-afip-equivale-aliarse-echegaray,3,"Se sacaron la máscara , son la misma escoria q los K .",cave6675,False
29883,18:55 07/10/2018,2.0,412,https://www.lanacion.com.ar/2179413-elisa-carrio-macri-va-tener-elegir-pero,0,Macri 2019/2023 - Vidal 2023/2031 Y los cimarrones en la cucha ,nesfer24,False
29907,18:53 07/10/2018,,412,https://www.lanacion.com.ar/2179413-elisa-carrio-macri-va-tener-elegir-pero,0,"Los cimarrones buscan vandalismo, no vuelven mas ",nesfer24,False
32556,15:07 08/10/2018,,430,https://www.lanacion.com.ar/2179692-iguacel-se-defendio-dijo-habrian-llovido-juicios,0,@gato_pardo555 @republicaonada MAS EMPRESAS COMPITIENDO ES PRECIO MAS BAJO Y MAS OFERTA,republicaonada,True
32557,15:20 08/10/2018,,430,https://www.lanacion.com.ar/2179692-iguacel-se-defendio-dijo-habrian-llovido-juicios,0,"@republicaonada @gato_pardo555 Pero no en empresas de servicios BURRRRRRO, no se pueden hacer ocho cloacas de agua para ocho compañias distintas de agua, ni 20 cableados distintos para electricas. Por BURRRROS como vos estamos como estamos. Hablando y repietendo pavadas sin saber absolutamente nada.",gato_pardo555,True
33637,17:47 08/10/2018,1.0,443,https://www.lanacion.com.ar/2179723-confirman-procesamiento-cristina-kirchner-sus-hijos-causa,0,"Bolsonaro presidente de America del Sur, los cimarrones terminan en Africa Ja!Ja!Ja! ",nesfer24,False
33685,17:39 08/10/2018,5.0,443,https://www.lanacion.com.ar/2179723-confirman-procesamiento-cristina-kirchner-sus-hijos-causa,5,"Quiero un presi como Bolsonaro, a los cimarrones palo y a la bolsa Ja!Ja!Ja!Ja! ",nesfer24,False
34626,22:07 09/10/2018,1.0,461,https://www.lanacion.com.ar/2180014-american-airlines-no-dejo-embarcar-familia-porque,0,"@fiscaldemesa Comparto, son unas bestias y están autorizados para destruir tu valija si no tiene la cerradura TSA. Luego de revisar cierran la valija con cinta oficial y el equipaje te lo paga Magoya.",Hank_Scorpio_33,True
36142,19:38 09/10/2018,,472,https://www.lanacion.com.ar/2180128-cuadernos-coimas-bonadio-cito-indagatoria-maximo-kirchner,0,Jefe de La Campora Ja!Ja!Ja!Ja! es una cargada para los cimarrones ,nesfer24,False
36754,18:05 09/10/2018,1.0,474,https://www.lanacion.com.ar/2180061-guillermo-moreno-roberto-navarro-sos-idiota-util,1,No dar bola a discusiones de estas bestias korruptas que lo unico que saben hacer es de felpudos de la jefa nafiosa,MabelZunino,False
36772,17:53 09/10/2018,4.0,474,https://www.lanacion.com.ar/2180061-guillermo-moreno-roberto-navarro-sos-idiota-util,1,No. En el jaula de las bestias brutas,MabelZunino,False
36792,19:41 09/10/2018,3.0,475,https://www.lanacion.com.ar/2180053-la-oposicion-convoca-sesion-anular-aumento-gas,0,"......TODO ESTE CIRCO ES PARA  DARLE,, LETRA A LA GGlllllLLLLAAADDAAA  ,,SON TAN BESTIAS Q' SABEN COMO DEFENDERSE SOLOS EN LA CALLE,.....Y SI NO LES DAN LETRA ESTAN FRITOS,........................",pcanoero,False
36901,19:17 09/10/2018,,475,https://www.lanacion.com.ar/2180053-la-oposicion-convoca-sesion-anular-aumento-gas,0,"@cserrano5 @mbetuska no digas  estupideces. cobarde.....  estas pidiendo perdón ahora,   gil....  te repito, el foro no es patente de corso, no podes decir cualquier cosa, pedazo de  animal, bestia... y además, no es un muro impenetrable... es facil  levantar la identida, de bestias como vos....  ",mbetuska,True
40800,21:14 11/10/2018,3.0,533,https://www.lanacion.com.ar/2180920-procesan-cupula-camioneros-extorsion,0,Pensar que hay bestias de éstas que ganan más que un investigador del Balseiro !! Cómo para que haya inversiones.,juanalacuerda,False
42762,23:45 12/10/2018,,563,https://www.lanacion.com.ar/2181169-sobresueldos-casacion-confirmo-condena-cuatro-anos-medio,0,Sres Jueces.........Metan Presos ... PERONISTAS... (de la era Menem).... basta de Maria Julias... para la Perrada P.....    Cavallo... Podra ser cualquier cosa... Pero todos saben vivio de lo suyo.... No afano lo que TODOS... sabemos afano la escoria eterna.. que gobernó por 70 años... y que sigue Jod....,radioperador,False
45424,21:48 14/10/2018,,618,https://www.lanacion.com.ar/2181728-macri-no-se-transforma-pais-noche-manana,0,"Tengo un amigo de 64 años, muy buen tipo, simpático, inteligente y vivo para lo que le gusta, totalmente honesto, moralmente incapaz de estafar a nadie. Lo conozco desde hace 34 años. Es hijo de una española de La Coruña y un inmigrante francés hijo de un general de la primera guerra, profesional, que llegó a tener un puesto bastante alto en la municipalidad de Bs As. Siempre vivió en la casa de sus padres, en un buen barrio de la Ciudad, junto con una hermana casada y con 3 chicos. Nunca tuvo que pagar ni el alquiler, ni la luz, ni el gas, ni el teléfono, ni el ABL, ni el seguro médico, y creo que ni la comida. Hizo una escuela secundaria de artes y oficios medio berreta. Lo más complejo que leyó fue Asimov. De joven se dedicó a comprar y vender discos en el Parque Rivadavia. Entre sus 18 y 28 trabajó con su cuñado, que tenía un tallercito de electrónica en el fondo de la casa. El hacía el trabajo más elemental de armar casi sin entender. Después puso una disquería de rarezas con un socio y durante unos años le fue relativamente bien. Hizo unos cuantos amigos bohemios para no decir vagos y chantas casi todos. Mucho café, mucho pool, mucha charla sobre rock & roll. Durante los primeros 80 se llevó a la novia a vivir a su casa. A mediados se separó y fue de vacaciones varias veces a Brasil. Se juntó con una mina 12 años mayor, uruguaya, peluquera, rubia teñida, corpulenta, caderuda, que usaba calzas de leopardo y tenía una hija medio lesbiana y medio tgola, con la que alquiló un departamento en el centro. Después de unos 7 años se separó, volvió a la casa de los padres. Durante un par de años tuvo una novia linda y “seria”, profesional, medio histérica. La importación le fundió la disquería. Se separó. Su padre murió grande. Su madre vivió con una buena pensión por su marido, nunca le faltó nada. Nadie de la familia se enfermó gravemente. Tuvo otras novias, y otros trabajos poco calificados, salvo durante unos meses en los que trabajó, acomodado por un amigo, manejando personal en una empresa que instalaba redes de agua en el conurbano. 
Siempre se quejó de que, cuando trabajó para su cuñado, este le pagaba muy poco, de que lo engañó con promesas de progreso que nunca llegaron, y de que le ocupó una gran parte de la casa y no le dejó espacio para sus cosas, todo lo cual yo sé que era cierto. (También es cierto que Alberto no aprovechó ciertos espacios más que suficientes para empezar). “Si yo no me hubiese quedado laburnado con este, a lo mejor hubiese conseguido laburo en la Philips y habría hecho carrera..."", repite Alberto cada tanto para explicar su decadencia. 
Hace 23 años se puso a trabajar de electricista domiciliario independiente, y zafaba con eso. 
Llegó a los 58 años sin haber formado familia, sin haber estudiado, sin haber hecho carrera en algún empleo, sin haberse profesionalizado en su oficio, viviendo con lo justo, sin haber ahorrado un mango. (Yo también trabajo como electricista desde hace 22 años, empecé desde mucho más abajo que él, me va razonablemente bien para ser un tipo sin familia que mantener, pago alquiler desde hace 26 años, tengo auto desde hace 18 años, y ahorro)
Hace 8 años murió su madre, la casa se vendió, el dinero se repartió entre los hermanos, y a él le quedaron 120 lucas verdes. Con 70 se compró un pequeño depto. en perfectas condiciones bien ubicado. 
Con las 50 lucas restantes… se compró un reproductor portátil de DVD, un TV plano, una cantidad de rieles, ménsulas, y estanterías para fijar a la pared, los pisos para cambiarle al depto. porque los que tenía no le gustaban aunque estaban perfectos, se fue 20 días a Brasil a visitar unas amigas, 2 semanas a Córdoba con otra amiga, 1 semana a conocer el tren de las nubes con un amigo...
Necesitaba un auto, realmente indispensable para su trabajo. Con la guita que tenía pudo comprarse 10. Se compró una motito de wachiturro, aun a sabiendas de que no le iba a servir para trabajar. “A mi me gusta el free style”, dijo cuando yo le hice notar que la moto no le iba a servir.
Hoy, 2018, el depto. está peor que al día siguiente de haberse mudado, con todas las cosas tiradas en el suelo, acumuladas hasta llenar el patio, las 2 habitaciones, la cocina, y el pequeño pasillo que une todo. No ordenó nada y encima juntó más porquerías. No se puede ni abrir la puerta. (El se quejaba de que su cuñado le había quitado el espacio en la casa de sus padres. Ahora que el cuñado no está, el espacio se lo quita él mismo).",Sergio115,False
46994,08:23 15/10/2018,6.0,636,https://www.lanacion.com.ar/2181776-despues-de-10-anos-se-va-el-barco-que-le-costo-al-pais-us1200-millones,0,"Hoy hay visitas en el penal de Marcos Paz para ver a Devido , quien se anota? la esposa dice que Julio comparte su celda con ratas todas las noches. Mi solidaridad con los roedores no se merecen convivir con semejante escoria",alapipeta4,False
47128,21:59 15/10/2018,1.0,638,https://www.lanacion.com.ar/2181980-a-65-anos-murio-paul-allen-uno,0,Quiénes son las bestias que traducen estos articulos? “Linfoma no relacionado con la enfermedad de hosgkin” es simplemente “linfoma no hodgkin”,jj.r6559,False
48780,18:44 15/10/2018,,651,https://www.lanacion.com.ar/2181893-el-macrismo-sale-caza-nuevos-militantes-prepara,0,@cborja @JamesJohnJoyce gano Hillary........mamita que tremendos bestias que hay en este foro,gguasoncito1,True
49340,17:29 15/10/2018,3.0,656,https://www.lanacion.com.ar/2181896-salio-bailar-lo-mataron-delicuentes-caballo,0,@-predator sos un hijo de mala madre. Escoria.,smr1967,True
50371,23:11 16/10/2018,,678,https://www.lanacion.com.ar/2182331-luis-carzoglio-no-me-van-correr-aprietes,0,"@Martiniano1991 @fcab1 es entendible, pero si todos nos vamos quien les da pelea a estas bestias",fcab1,True
50392,23:03 16/10/2018,2.0,678,https://www.lanacion.com.ar/2182331-luis-carzoglio-no-me-van-correr-aprietes,0,"Los cimarrones saltaban y gritaban, son ignorantes hasta cuando los afanan ",nesfer24,False
51014,21:10 16/10/2018,1.0,678,https://www.lanacion.com.ar/2182331-luis-carzoglio-no-me-van-correr-aprietes,0,En cana todos estos marrones,Dreamwever,False
51760,20:36 16/10/2018,2.0,680,https://www.lanacion.com.ar/2182302-moyano-celebro-fallo-del-juez-desafia-ahora,0,No salen de sus mansiones sin estar rodeados de heladeras marrones que los custodian... por qué será?... por trigo limpio seguro que no!!,Ossie_Mu,False
51800,20:31 16/10/2018,2.0,680,https://www.lanacion.com.ar/2182302-moyano-celebro-fallo-del-juez-desafia-ahora,0,"Ya no quedan dudas que en Argentina se libra una guerra racial.

El excremento de piel marrón no quiere aceptar que se acabó la extorsión y parasitismo con el que recibieron a los blancos europeos desde 1870...

El peronismo no es más que la guerra silenciosa de la escoria indocriolla contra la raza blanca que construyó TODO en Argentina.

Si no se reacciona ahora, estará todo perdido.

Como dijo Sarmiento, tiene que correr sangre de homínidos si queremos construir una repúlblica basada en leyes.",Fela_Kuti,False
52362,21:42 17/10/2018,,693,https://www.lanacion.com.ar/2182679-coloquio-idea-presencia-figuras-economia-politica-comienza,0,"El presidente Macri está demostrando una gran ignorancia en todo,incluido Historia. Por ejemplo, en el tema KAMIKAZES. Desde la 2da. Guerra mundial que no hay kamikazes japoneses.Sin embargo,hace unos días,le expresó su malestar al embajador japonés en Argentina porque las inversiones japonesas prometidas no habían llegado.Un consejo al presidente:¿por qué no vuelve a insistir mostrándole al embajador japonés el fallo de hoyde la injusticia argenta ratificando las facultades extraordinarias de laAFIP para suspender la CUIT?Macri debe AGRADECERLE al embajador japonés que con las barbaridades tributarias que están haciendo las empresas japonesas que hoy están NO HUYAN.
Adjunto link del fallo de  las bestias de los jueces

https://www.cronista.com/economiapolitica/AFIP-consiguio-via-libre-judicial-para-suspender-la-CUIT-20181017-0021.html",rebelionfiscal,False
54239,22:28 17/10/2018,1.0,708,https://www.lanacion.com.ar/2182714-maria-eugenia-vidal-coloquio-idea-el-cambio,0,"¿ahora se acuerdan que necesitan a las empresas para mantener el empleo?  ¿no pudieron pensarlo antes de sancionar la ley terrorista tributaria terrorista 27430, y entre otras barbaridades de esa ley,  su nefasto artículo 189 hoy ratificado por los bestias de la Cámara en lo Contencioso Administrativo Federal, que autoriza a la AFIP a suspender la CUIT,  engendro que ni siquiera debería existir?   ¿en qué nube vive esta mujer?  en una de p2  o en la de Oort?",rebelionfiscal,False
54319,21:49 17/10/2018,1.0,708,https://www.lanacion.com.ar/2182714-maria-eugenia-vidal-coloquio-idea-el-cambio,6,"Cínica e ignorante.  Tendría que haber dicho   ""necesitamos a los empresarios para seguir saqueándolos"". ¿Acaso ignora la gobernadora que su Provincia es el reino del terrorismo fiscal?  ¿La gobernadora en persona acaso no RATIFICÓ A TODO EL EQUIPO TERRORISTA DE ARBA DEL SCIOLISMO,  desde el último vago hasta su jefe, Fossati?   ¿se enteró la gobernadora del fallo, hoy de la Cámara en lo Contencioso Administrativo Federal ratificando el artículo 189 de la ley terrorista fiscal 27430,  que le permite a los animales de la AFIP suspender la CUIT y privar de todos los derechos y capacidad de trabajo a cualquier contribuyente?     Sólo los sostiene el miedo de la clase media a Cristina,  porque si no hoy tendrían a toda la gente en las calles contra Ustedes,  manga de bestias. ",rebelionfiscal,False
55052,22:24 17/10/2018,5.0,713,https://www.lanacion.com.ar/2182688-mendoza-inadi-se-pronuncio-favor-joven-musulmana,1,"@pepardo2000 El inadi es un rejunte de nazis, debe ser eliminado.",Lavite,True
55053,00:24 18/10/2018,,713,https://www.lanacion.com.ar/2182688-mendoza-inadi-se-pronuncio-favor-joven-musulmana,0,@Lavite @pepardo2000 Veo que estás muy empapado en temas ideógicos ,Fuerteventura,True
55054,22:58 17/10/2018,1.0,713,https://www.lanacion.com.ar/2182688-mendoza-inadi-se-pronuncio-favor-joven-musulmana,3,"@pepardo2000 Es discriminacion, lisa y llana.",GharDell,True
55207,09:04 19/10/2018,12.0,717,https://www.lanacion.com.ar/2183071-una-derrota-olimpica-futsal-argentino-no-entendio,3,"Porque no aprenden del rugby, un deporte de bestias jugado por caballeros, en cambio el futbol es un deporte más delicado jugado y alentado por bestias.",enriquefrias,False
55259,23:33 18/10/2018,12.0,717,https://www.lanacion.com.ar/2183071-una-derrota-olimpica-futsal-argentino-no-entendio,0,"Tambien es culpa del cuerpo tecnico.
Ellos.son los que deben dar el ejemplo.
Si a pibes de entre 14 y 18 años no los educas con principios de honor, honestidad y caballerosidad y sobre todo HUMILDAD en el deporte, no esperes milagros.
Despues tenemos a los bestias que hay en las primeras divisiones de futbol.
Todos fanfarrones llenos de $ que buscan encamarse con el gato de turno.",andresmazzu,False
56562,15:14 18/10/2018,3.0,741,https://www.lanacion.com.ar/2182912-como-sera-recibimiento-pablo-moyano-ezeiza,0,"El ""SALVAJE"" terminará preso. el juez será apartado de la causa y el recibimiento de Pablito se convertirá en una de las grandes farsas de la historia del peronismo gremialista. Por otra parte, Hugo Moyano también irá preso por corrupto y asesino. Padre e hijo no se sacan diferencias .Son dos verdaderas bbestias en todo el sentido de la palabra. ",baci67,False
