,es_respuesta,fecha,likes,nota_id,respuestas,texto,url,usuario,autor,seccion,titulo,severe_toxicity,toxicity
21307,False,00:52 04/10/2018,,299,0.0,"A favor o en contra de la pena de muerte para los asesinos, pedofilos, violadores, los marcos y los funcionarios públicos cuyo corrupción sea causal de muerte?",https://www.lanacion.com.ar/2178179-arreglo-cita-facebook-fue-drogada-violada,Gaviiota,,Sociedad,Arregló una cita por Facebook y fue drogada y violada,0.8825915000000001,0.77750224
14149,False,14:44 30/09/2018,5.0,209,0.0,Marche pena de muerte para el milico,https://www.lanacion.com.ar/2177120-peaje-muerte-discusion-tiro-arma-pelea-autopista,aespina4,,Sociedad,"Un prefecto discutió con otro automovilista, se bajó del vehículo con un arma y lo mató en la Illia",0.7266589,0.6457271
48866,True,21:14 16/10/2018,2.0,680,0.0,@abelmonte4 coincido que a veces hace falta un rifle sanitario para terminar con estas especies de ladrones,https://www.lanacion.com.ar/2182302-moyano-celebro-fallo-del-juez-desafia-ahora,fcab1,Nicolás Balinotti,Política,Moyano celebró el fallo del juez y desafía ahora con paritarias de 42%,0.56116796,0.62032247
32114,False,17:49 08/10/2018,8.0,443,2.0,"SON 200 MIL MILLONES DE DOLARES LOS SAKEADOS POR LA ASOCIACION ILICITA K ..... LOS PODRAN COLGAR, AGUILLOTINAR, FUSILAR O DARLES CADENA PERPETUA..... PERO LO QUE MAS ME IMPORTA ES QUE APAREZCA EL DINERO SAKEADO.... ",https://www.lanacion.com.ar/2179723-confirman-procesamiento-cristina-kirchner-sus-hijos-causa,Just4Justice,,Política,Confirman el procesamiento de Cristina Kirchner y sus hijos en la causa Hotesur,0.80286556,0.6168899
20249,True,23:37 03/10/2018,,291,0.0,@Caida_Libre @Myanki Hay que borrar todos los tratados que prohiben la pena de muerte,https://www.lanacion.com.ar/2178192-el-gobierno-sumo-apoyo-dos-gobernadores-mas,masademar,Santiago Dapelo,Política,El Gobierno sumó el apoyo de dos gobernadores más para el presupuesto,0.5969621999999999,0.50948304
46999,False,19:24 16/10/2018,5.0,659,0.0,"Romero fue siempre un arquero de mediocre para abajo. Jamas sale, no retiene pelotas faciles. Es como jugar con uno menos.
Por algo es siempre suplente en el equipo donde juega.",https://www.lanacion.com.ar/2182282-argentina-brasil-todo-lo-dejo-clasico-sudamericano-arabia,rduaygues,,Deportes,Lo que dejó Argentina-Brasil: la cantidad de patadas a Neymar y la explicación del gol de Miranda,0.30991256,0.4251348
54388,False,20:40 18/10/2018,2.0,746,2.0,LA PENA DE MUERTE DISMINUYE EL ÍNDICE DE REINCIDENCIA.,https://www.lanacion.com.ar/2183027-san-miguel-vecinos-tiraron-piedras-se-enfrentaron,jorgerai,,Sociedad,San Miguel: vecinos tiraron piedras y se enfrentaron a la policía luego de la aparición del cuerpo de Sheila Ayala,0.56116796,0.4251348
54479,False,20:19 18/10/2018,4.0,746,0.0,La Pena de Muerte salvaría muchas vidas. Es lo que se merecen los monstruos que la asesinaron.- ,https://www.lanacion.com.ar/2183027-san-miguel-vecinos-tiraron-piedras-se-enfrentaron,omarhess,,Sociedad,San Miguel: vecinos tiraron piedras y se enfrentaron a la policía luego de la aparición del cuerpo de Sheila Ayala,0.56116796,0.39574838
46920,False,16:50 15/10/2018,7.0,656,1.0,En EE.UU seria derecho pena de muerte para el ejecutor y perpetua (sin salida de por vida) para todos los complices. Aca cuando vamos a cambiar las leyes? Es muy complicado agarrar a tres asesinos? uno encima iba a Caballo?,https://www.lanacion.com.ar/2181896-salio-bailar-lo-mataron-delicuentes-caballo,nxxx,,Sociedad,"Guernica: tenía 18 años, fue a bailar con amigos y delincuentes lo mataron a golpes",0.56116796,0.3727785
54101,False,22:54 18/10/2018,4.0,746,0.0,"Tenemos que mantener a las cucas y a los limìtrofes, no hay billetera que aguante, rifle sanitario ",https://www.lanacion.com.ar/2183027-san-miguel-vecinos-tiraron-piedras-se-enfrentaron,nesfer24,,Sociedad,San Miguel: vecinos tiraron piedras y se enfrentaron a la policía luego de la aparición del cuerpo de Sheila Ayala,0.41315052,0.36905587
45098,False,21:33 15/10/2018,4.0,639,0.0,Hay que volver a la vieja y noble  tradición de la pena de muerte,https://www.lanacion.com.ar/2181983-cada-vez-mas-cerca-bolsonaro-mantiene-amplia,ermindogranero,,El Mundo,Cada vez más cerca: Bolsonaro mantiene una amplia ventaja de cara al ballottage,0.40389013,0.3076429
51889,True,18:23 17/10/2018,,711,0.0,@gguasoncito1 @fper7709 Si. Hay que aplicar el rifle sanitario.,https://www.lanacion.com.ar/2182602-dividido-peronismo-festeja-dia-lealtad-actos-masivos,jstaffa holtmann,,Política,"Con críticas al Gobierno y llamados a la unidad, el peronismo festeja dividido el Día de la Lealtad",0.19559045,0.24863577
52502,False,22:01 18/10/2018,,717,4.0,"Lo Vi... estuvieron mal los chicos claramente pero no hay que darle demasiada trascendencia, no matarlos. La verdad es que hay que contextualizar la frustración de los chicos, como se dió el partido, de dónde venían (derrota con Brasil), la presión del local, lo que significa el fútbol y que tienen menos de 18 años... Deben aprender de sus errores y recaptizar, pero noto demasiada intolerancia en algunos comentarios.",https://www.lanacion.com.ar/2183071-una-derrota-olimpica-futsal-argentino-no-entendio,Gramsci2,Claudio Cerviño,Deportes,Una derrota olímpica: el Futsal argentino no entendió el espíritu de los Juegos,0.32849520000000004,0.23113567
49130,False,20:22 16/10/2018,2.0,680,0.0,esto se arreglaría con un rifle sanitario,https://www.lanacion.com.ar/2182302-moyano-celebro-fallo-del-juez-desafia-ahora,fcab1,Nicolás Balinotti,Política,Moyano celebró el fallo del juez y desafía ahora con paritarias de 42%,0.1559569,0.19863188
50028,False,21:06 18/10/2018,2.0,698,1.0,Por lo que dicen.. para mi bien muerto esta. Hay justicia divina,https://www.lanacion.com.ar/2182594-ojala-te-pudras-infierno-mensaje-madre-hijo,luigi501,,El Mundo,"""Ojalá te pudras en el infierno"": el mensaje de una madre a su hijo muerto que reveló un pasado oscuro",0.17329139,0.18077709
63448,False,16:50 23/10/2018,2.0,862,0.0,"Pueden decir lo que quieran de USA, pero aca en Texas un delito asi es pena de muerte.",https://www.lanacion.com.ar/2184246-en-su-intento-defensa-sheila-tambien-le,marceloricardo52,Gabriel Di Nicola,Sociedad,Sospechan que Sheila también le provocó lesiones de defensa a su tía,0.13232192,0.124138914
63460,True,08:52 23/10/2018,5.0,862,0.0,"@ofrontini1 sí, pena de muerte ,  si hay pruebas suficientes, sin dudas, supongo que habrá presupuesto para realizar los estudios necesarios para comprobarlo. ",https://www.lanacion.com.ar/2184246-en-su-intento-defensa-sheila-tambien-le,luisa22,Gabriel Di Nicola,Sociedad,Sospechan que Sheila también le provocó lesiones de defensa a su tía,0.12538059,0.12078999
54407,True,20:44 18/10/2018,,746,1.0,creo que tiraron piedras porque querian linchar a los tios y la policia no los dejaba,https://www.lanacion.com.ar/2183027-san-miguel-vecinos-tiraron-piedras-se-enfrentaron,Hallu07,,Sociedad,San Miguel: vecinos tiraron piedras y se enfrentaron a la policía luego de la aparición del cuerpo de Sheila Ayala,0.039045975,0.07895253599999999
13894,False,15:57 30/09/2018,2.0,208,0.0,UNO MENOS........,https://www.lanacion.com.ar/2177124-temporal-pilar-arroyo-adolescente-desaparecido-cristina-roldan,KIM_JONG_MAXIMUN,,Sociedad,Pilar: hallaron muerto al joven que se tiró a un arroyo en medio del temporal,0.005616434,0.024330842999999998
14096,False,17:27 30/09/2018,,209,3.0,"Han fusilado criaturas de 12 años y han sido asendidos en sus cargos por las autoridades, significa que hay una bajada de línea de matar ante la mínima duda! En un país donde hay miles de desaparecidos y miles de asesinados por las fuerzas de seguridad, en vez de inculcar valores democráticos a las fuerzas les inculcan el matar por matar! Esto de fusilar no es democracia!! Es dictadura!!!!",https://www.lanacion.com.ar/2177120-peaje-muerte-discusion-tiro-arma-pelea-autopista,garcia_2008,,Sociedad,"Un prefecto discutió con otro automovilista, se bajó del vehículo con un arma y lo mató en la Illia",,
14108,False,17:15 30/09/2018,3.0,209,0.0,"Muy , pero muy pronto , esto va a ser el comportamiento común de la gente ... Instauraron el odio , la grieta , la inseguridad y el sálvese quien pueda .   Cristina y Asociados :  Fusilarlos ,.. es poco ! ",https://www.lanacion.com.ar/2177120-peaje-muerte-discusion-tiro-arma-pelea-autopista,Indianapolis,,Sociedad,"Un prefecto discutió con otro automovilista, se bajó del vehículo con un arma y lo mató en la Illia",,
16936,False,22:42 01/10/2018,10.0,231,0.0,UNO MENOS !!!! ,https://www.lanacion.com.ar/2177450-atropello-mato-uno-ladrones-intento-asaltarlo-plena,mari_posita,,Política,Atropelló y mató a uno de los ladrones que intentó asaltarlo en plena ruta 9,,
16943,False,22:16 01/10/2018,1.0,231,1.0,por una ley de linchamiento a los malandras,https://www.lanacion.com.ar/2177450-atropello-mato-uno-ladrones-intento-asaltarlo-plena,pablo19666,,Política,Atropelló y mató a uno de los ladrones que intentó asaltarlo en plena ruta 9,,
16945,False,22:15 01/10/2018,1.0,231,0.0,UNA BASURA MENOS....UN PERONIO MENOS !! MENSION DE HONOR A ESTE BUEN CIUDADANO!!.,https://www.lanacion.com.ar/2177450-atropello-mato-uno-ladrones-intento-asaltarlo-plena,rumiante,,Política,Atropelló y mató a uno de los ladrones que intentó asaltarlo en plena ruta 9,,
16959,False,21:30 01/10/2018,5.0,231,0.0,uno menos,https://www.lanacion.com.ar/2177450-atropello-mato-uno-ladrones-intento-asaltarlo-plena,ignajo,,Política,Atropelló y mató a uno de los ladrones que intentó asaltarlo en plena ruta 9,,
16976,False,20:34 01/10/2018,3.0,231,0.0,"si es asi,,   ademas de haber uno menos jodiendo,,esta bien ",https://www.lanacion.com.ar/2177450-atropello-mato-uno-ladrones-intento-asaltarlo-plena,dlodeiro,,Política,Atropelló y mató a uno de los ladrones que intentó asaltarlo en plena ruta 9,,
17034,False,18:45 01/10/2018,13.0,231,0.0,Uno menos.,https://www.lanacion.com.ar/2177450-atropello-mato-uno-ladrones-intento-asaltarlo-plena,lschroeder,,Política,Atropelló y mató a uno de los ladrones que intentó asaltarlo en plena ruta 9,,
17044,False,18:33 01/10/2018,6.0,231,0.0,¡Héroe! ¡Vamos todavía! ¡ Uno menos que no se va a reproducir! Que le garpe el costo de chapa y pintura la familia del chorito,https://www.lanacion.com.ar/2177450-atropello-mato-uno-ladrones-intento-asaltarlo-plena,elciclope4,,Política,Atropelló y mató a uno de los ladrones que intentó asaltarlo en plena ruta 9,,
31466,False,19:30 08/10/2018,6.0,442,0.0,Rifle sanitario,https://www.lanacion.com.ar/2179742-el-juez-canicoba-permisos-manejar-autos-alta,conradorodr,Iván Ruiz,Política,"El juez Canicoba, con permisos para manejar autos de alta gama a nombre de familiares y un empresario",,
32673,False,19:03 08/10/2018,1.0,447,0.0,Estos individuos no son recuperables. Hay que tratar la Pena de Muerte.-,https://www.lanacion.com.ar/2179744-piden-perpetua-quienes-drogaron-violaron-mataron-su,sogtulakk,Darío Palavecino,Sociedad,"Piden perpetua para quienes drogaron, violaron y mataron a su hija en Mar del Plata",,
32687,False,22:29 08/10/2018,7.0,449,0.0,"ojalá los encuentren... en estos casos definitivamente yo estaría a favor de la pena de muerte.
Por otro lado, ya que esto es posible,  no estaría bueno tener una base de datos con el ADN de todos los argentinos? al momento de hacer el DNI del bebé, se le saca la muestra.",https://www.lanacion.com.ar/2179703-para-resolver-crimen-nino-extraen-adn-3000,msegovia8,,Sociedad,Para resolver el crimen de un niño extraen muestras de ADN a 3000 personas en un pueblo santiagueño,,
36463,False,23:30 10/10/2018,,490,0.0,"En la cárcel, que parezca un accidente y listo. Uno menos.",https://www.lanacion.com.ar/2180538-hablo-femicida-ecatepec-voy-seguir-matando-mujeres,DOMINOR1,,El Mundo,"Habló el femicida de Ecatepec: ""Voy a seguir matando mujeres""",,
36468,False,22:44 10/10/2018,2.0,490,0.0,La pena de muerte vale la pena,https://www.lanacion.com.ar/2180538-hablo-femicida-ecatepec-voy-seguir-matando-mujeres,ElJusto_NewYork,,El Mundo,"Habló el femicida de Ecatepec: ""Voy a seguir matando mujeres""",,
36470,False,21:39 10/10/2018,2.0,490,0.0,es el momento de aplicar el rifle sanitario,https://www.lanacion.com.ar/2180538-hablo-femicida-ecatepec-voy-seguir-matando-mujeres,COCORICARDO,,El Mundo,"Habló el femicida de Ecatepec: ""Voy a seguir matando mujeres""",,
36472,False,20:35 10/10/2018,5.0,490,0.0,y matenlo de una listo que tanto.,https://www.lanacion.com.ar/2180538-hablo-femicida-ecatepec-voy-seguir-matando-mujeres,larguirucho_pepe,,El Mundo,"Habló el femicida de Ecatepec: ""Voy a seguir matando mujeres""",,
42125,False,23:53 13/10/2018,6.0,587,1.0,"Pablito, ya que estás en Singapur podrías quedarte allí para siempre. Salvo por el problema que allí aquellos que violan las leyes terminan en la cárcel casi instantáneamente, y los azotes están permitidos, lo mismo que la pena de muerte.",https://www.lanacion.com.ar/2181521-pablo-moyano-singapur-no-creo-hagan-show,Maximo_Bruto,,Política,"Pablo Moyano, desde Singapur: ""No creo que hagan el show de querer detenerme en Ezeiza""",,
54244,False,21:35 18/10/2018,3.0,746,0.0,"La unica que perdió fue la niña, los culpables tienen la suerte de estar acá...hasta la pueden sacar barata...que lástima que no tenemos pena de muerte , estos se la merecen con creces....",https://www.lanacion.com.ar/2183027-san-miguel-vecinos-tiraron-piedras-se-enfrentaron,leoliam,,Sociedad,San Miguel: vecinos tiraron piedras y se enfrentaron a la policía luego de la aparición del cuerpo de Sheila Ayala,,
57265,True,10:08 20/10/2018,,774,0.0,"@KIM_JONG_MAXIMUN Que se quede donde esta, bastante desastre nos dejo, bien muerto esta",https://www.lanacion.com.ar/2183362-desde-martes-cierran-avenida-cordoba-desmantelar-puente,CiudadHumana,,Sociedad,"Desde el martes, cierran por un mes la avenida Córdoba para desmontar el puente",,
61738,True,18:44 22/10/2018,2.0,847,0.0,@parenderobar Quedate tranquilo que si lo hacia en Japon le daban pena de muerte.,https://www.lanacion.com.ar/2184093-la-historia-del-canibal-japones-se-comio,Seba_Uribarri,,El Mundo,La historia del caníbal japonés que se comió a una holandesa y se convirtió en estrella,,
63070,False,18:59 22/10/2018,3.0,861,2.0,DEVOLVERÁ UNA PEQUEÑA PARTE DE LO ROBADO. PERPETUA O PENA DE MUERTE LE DARÍAN EN EL PRIMER MUNDO Y CHINA RESPECTIVAMENTE.,https://www.lanacion.com.ar/2184183-ricardo-jaime-cumplira-pena-cuatro-anos-enriquecimiento,parenderobar,Hernán Cappiello,Política,Ricardo Jaime cumplirá una pena de cuatro años por enriquecimiento ilícito y pagará una multa de $13 millones,,
63072,True,19:08 22/10/2018,1.0,861,0.0,En China hay pena de muerte para políticos corruptos.,https://www.lanacion.com.ar/2184183-ricardo-jaime-cumplira-pena-cuatro-anos-enriquecimiento,wknackwurst,Hernán Cappiello,Política,Ricardo Jaime cumplirá una pena de cuatro años por enriquecimiento ilícito y pagará una multa de $13 millones,,
63118,False,18:43 22/10/2018,,861,0.0,Se merece por lo menos pena de muerte. Y devolucion de todo lo robado.,https://www.lanacion.com.ar/2184183-ricardo-jaime-cumplira-pena-cuatro-anos-enriquecimiento,soyn2093,Hernán Cappiello,Política,Ricardo Jaime cumplirá una pena de cuatro años por enriquecimiento ilícito y pagará una multa de $13 millones,,
63491,False,10:45 23/10/2018,2.0,864,0.0,"Hay que implantar la pena de muerte para todos los cabecillas de narcotraficante, de lo contrario siempre hay quienes los suplanta. ",https://www.lanacion.com.ar/2184092-operativo-jimmy-desbaratan-banda-abastecia-droga-mar,rodolfotrev,,Sociedad,"Operativo Jimmy: desbaratan una banda que abastecía de droga a Mar del Plata, Bahía Blanca y el conurbano",,
63493,False,21:45 22/10/2018,4.0,864,0.0,"Para estos personajes habría que instaurar la pena de muerte. No tienen ninguna chance de recuperación. Además, ni bien salen vuelven a hacer lo mismo. Basta de piedad con estos depravados. ",https://www.lanacion.com.ar/2184092-operativo-jimmy-desbaratan-banda-abastecia-droga-mar,candidotempo,,Sociedad,"Operativo Jimmy: desbaratan una banda que abastecía de droga a Mar del Plata, Bahía Blanca y el conurbano",,
